JobTitle,company,location,salary,date_posted,ExtractDate,job_url,summary,review_url,overall_rating,num_ratings
Internship,ECO-SHOP MARKETING SDN BHD,Jementah,"RM 1,100 per month",19d ago,19/5/2024,https://www.jobstreet.com.my/job/75475057?type=standout&ref=search-standalone&origin=cardTitle#sol=1bfb88b0799f87ebfa016b1455ec01952d4a2fc2,we are currently offering job opportunities for internship for below departments:- financeinformation technologysupply chaine-commerce job responsibilitiesresponsible for daily operational matters in the respective department. support ad hoc and any other duties as required in the department.participate in a variety of assignments in functional areas.work closely within the department.learning technical skills related to the industry. job requirementsstudents who possess a diploma or degree in relevant fields are welcome to apply.have basic knowledge of operating microsoft office.candidates who can join immediately will be an added advantage.internship period: minimum 3 months.able to communicate with the team.,https://www.jobstreet.com.my/companies/eco-shop-168492759171103/reviews?jobId=75475057,3.6,32
Intern for Computer Science Engineering/Mechanical Engineering (May'24 – Oct'24),Bericap Malaysia Sdn. Bhd.,Kulai,undisclosed,19d ago,19/5/2024,https://www.jobstreet.com.my/job/75469929?type=standout&ref=search-standalone&origin=cardTitle#sol=78abbce85b587cbfddf5de3a55a85c2ff4cf1e8f,"learning exposure:  fulfilling tasks assigned by a supervisorlearning technical skills related to plastic injection moulding industryassist in preparing information and research materials; create and maintain power point presentationsmanage databases and input information, data, and recordsdigitalize documentation, process improvement project shadow multiple office positions and train in a variety of tasks job requirements: degree from computer science engineering / electrical & electronics / mechanical / mechatronics / industrial / chemical engineering or equivalent.internship period preferable: 6 monthsgood communication skills and proficient in englishproactive problem solving, follow up and negotiation skills  kindly stated down internship period and latest cgpa in uploaded resume.only shortlisted students would be contacted by human resource department.",https://www.jobstreet.com.my/companies/bericap-malaysia-168556085915716/reviews?jobId=75469929,3.8,4
Internship Trainee (IT),Kawan Food Manufacturing Sdn Bhd,Pulau Indah,RM 600 per month,20d ago,19/5/2024,https://www.jobstreet.com.my/job/75466588?type=standout&ref=search-standalone&origin=cardTitle#sol=141916a4a084242ad9155081f81161bb3cabc42d,duties and responsibilitiesto support it team members on day-to-day tasks.to help manage and maintain documentations and administrative tasks.perform other duties and responsibilities as assigned by the superior. work requirementspossess or currently pursuing a diploma / bachelor’s degree in information technology or equivalent.must be willing to travel to pulau indah.available for internship duration of 3-6 months.,https://www.jobstreet.com.my/companies/kawan-food-berhad-168555055346050/reviews?jobId=75466588,3.1,23
Fulfillment Intern,TIME dotCom Berhad,Glenmarie,undisclosed,20d ago,19/5/2024,https://www.jobstreet.com.my/job/75465609?type=standout&ref=search-standalone&origin=cardTitle#sol=e8f3edfb2ba7345342df9c105ef447e4f3c653d0,"fulfilment intern responsibilities:1. appointment coordination:   - manage and coordinate scheduled appointments between customers and vendors during visitation.2. appointment rescheduling:   - reschedule appointments based on customers' requests and coordinate with vendors for necessary changes.3. customer follow-up:   - follow up with customers regarding required documents for seda and nem applications.4. technical proposal management:   - manage all approved technical proposals and forward them to the sales team for the next steps.5. application status monitoring:   - check seda & nem application status, providing updates on the latest status for project progress.6. document verification:   - verify that collected documents are in order.7. document preparation:   - prepare the required documents for the project manager before scheduled site visits. learning opportunities:- gain hands-on experience in solar sales fulfilment processes.- develop skills in customer engagement and coordination.- understand the intricacies of renewable energy applications (seda & nem).- enhance organizational and document management skills.- collaborate with cross-functional teams and contribute to project progress. skills:- experience in managing sales fulfilment is an added advantage.- meticulous work ethic.- adaptability to work in an environment that utilizes multiple applications.- preferably a bachelor's degree in business administration and marketing.",https://www.jobstreet.com.my/companies/time-dotcom-berhad-168553707023444/reviews?jobId=75465609,3.8,74
Internship for Graphic Design/ Multimedia,Safetyware Group Berhad,Bukit Minyak,RM 850 – RM 851 per month,20d ago,19/5/2024,https://www.jobstreet.com.my/job/75463205?type=standout&ref=search-standalone&origin=cardTitle#sol=493300fd5c09e7ed57a3d3f13d206639bbc690f3,"job description:* create initial artwork for customers or company use.* ensure correct artwork in work orders.* organize and update design files.* other ad-hoc tasks assigned by superior.job requirement:* candidate must possess at least bachelor's degree/post-graduate diploma/professional degree multimedia courses.* familiarity with design software and technologies (such as photoshop)* required language(s): english, bahasa malaysia.* knowledge in mandarin is an added advantage.* no working experience is required.* minimum 3 months internship.",https://www.jobstreet.com.my/companies/safetyware-group-168550740853918/reviews?jobId=75463205,4.5,10
"Jobs for Computer Science, IT and Software Engineering Graduates",Keysight Technologies Malaysia Sdn. Bhd.,Bayan Lepas,undisclosed,20d ago,19/5/2024,https://www.jobstreet.com.my/job/75463124?type=standout&ref=search-standalone&origin=cardTitle#sol=a0e0fe86293141c276ac8f987e8296dd374c50ad,"join our cutting-edge team and be the driving force behind the next technological revolution. embrace the challenge of creating groundbreaking innovations and industry-leading solutions that shape the future.unleash your passion for technology, innovation, and vision, and transform your aspirations into reality. find out more - design and test software | keysightwe seek graduates who have passion, a relentless drive for innovation, and have the vision to look to the future, and the inspiration to make that vision a reality. we have various exciting technical openings for recent graduates such as software developers (programmers), web developers (full stack engineer), ux/ui designers, devops developers, software engineers, test engineers, automation engineers, it network or application engineer etc in r&d, manufacturing, it or other departments.as a graduate, you will first learn about our businesses, products, solutions, projects, platform, programming languages and etc.based on the assignment, you could be responsible for designing, coding, supporting, testing and debugging software related applications.our experienced mentors are here to guide you every step of the way, providing invaluable insights and support. additionally, the company has various platforms for you to empower you to acquire the necessary skills or technologies to excel in your field.be a part of a team that dares to push boundaries, redefine possibilities, and shape the future of technology.job qualificationcandidate must possess at least a bachelor's degree, in computer science/information technology, software engineering or equivalent.no work experience required.to secure the job, we are looking for candidates with attention to detail, good interpersonal skills, a growth mindset, and curiosity in problem-solving.",https://www.jobstreet.com.my/companies/keysight-technologies-168551179724998/reviews?jobId=75463124,4.6,889
Multimedia Internship (Video Editing and Shooting),IQI REALTY SDN. BHD. (YC),Johor Bahru,"RM 1,000 – RM 1,500 per month",20d ago,19/5/2024,https://www.jobstreet.com.my/job/75454731?type=standout&ref=search-standalone&origin=cardTitle#sol=23eba16668dead734aaaf4deaa300981c2d67492,"iqi global is a leading real estate company, and we are excited to offer an internship opportunity for talented and creative individuals to join our team as online content generation interns. this internship will provide you with valuable hands-on experience in creating engaging online content, with a specific focus on video editing and shooting. we are seeking dynamic individuals who are passionate about real estate and eager to make a mark in the digital world.responsibilities:- collaborate with the marketing team to plan and execute video content that aligns with iqi global's brand identity and marketing objectives.- capture high-quality video footage of properties, events, and interviews to showcase iqi global's real estate offerings.- edit raw footage into compelling videos, adding background music, graphics, and effects to enhance the visual appeal.- implement post-production techniques such as color correction, sound editing, and visual enhancements.- stay updated with the latest trends in video editing and shooting, and contribute fresh ideas to improve content quality and engagement.- ensure timely delivery of content and meet project deadlines.requirements:- currently enrolled in or recently graduated from a relevant degree program in film production, digital media, communications, or a related discipline.- proficiency in video editing software such as adobe premiere pro, final cut pro, or similar tools.- basic knowledge of videography principles, including composition, lighting, and sound.- familiarity with various video formats and specifications for online platforms.- strong attention to detail and a keen eye for visual aesthetics.- ability to work independently and collaboratively within a team.- excellent time management skills and ability to prioritize tasks.- a portfolio of previous video editing and shooting work (if available) is an advantage.why iqi global:- a prominent real estate company with a global presence in multiple countries.- work with a diverse and talented team, gaining exposure to international real estate markets.- contribute to cutting-edge digital marketing efforts.- access to state-of-the-art equipment and software for unleashing your creativity.- valuable industry experience and potential for future growth within iqi global.",https://www.jobstreet.com.my/companies/iqi-realty-168552297336400/reviews?jobId=75454731,4.2,12
IT & Digital Internship Programme,LAZIC GROUP SDN. BHD.,Melaka,"RM 700 – RM 1,000 per month",22d ago,19/5/2024,https://www.jobstreet.com.my/job/75445894?type=standout&ref=search-standalone&origin=cardTitle#sol=83cfac2873570cdc69e1dc8ff2703156e3fa53af,"if you are an amazing talent in graphic and videography, e-commerce, it and multimedia who wants to make great experience and the best environment at an amazing company, then keep reading!we are known as lazic group sdn bhd, located in ayer keroh, melaka. we have been in the beauty and health industry since 2015 and now growing in investment rapidly. now we have subsidiaries that focus on stock market trading and land and property.if you wish to have the best milestone in your career, do not hesitate to drop your resume and list us what you wish to learn during your internship period.on the job training will be provided, we never leave you hanging. welcome onboard talent!",https://www.jobstreet.com.my/companies/lazic-group-168551529628063/reviews?jobId=75445894,4.3,3
"Internship, Receiving Support",GE Aviation,Selangor,undisclosed,22d ago,19/5/2024,https://www.jobstreet.com.my/job/75444371?type=standard&ref=search-standalone&origin=cardTitle#sol=5e8eeccdec91dd41368e94d83171d1f1b9d7c8ec,"job description summaryresponsible to ensure inbound documentation and transaction in sap meeting the daily kpi.job descriptionessential responsibilities:

to ensure inbound documentation and transaction in sap meeting the daily kpi.
assist in clearing good inward report.
receiving and checking deliveries to ensure that correct amount, part number, part description and quantity is delivered.
assist to check all customs documentation and paperwork attached to received item.
consignment without paperwork to be highlighted to receiving inspector for fast follow up or email to respective owner to take action.
to check receiving of parts and ensure with awb number and customs documentation for easy reference.
any discrepancy on packaging of parts shall be highlighted to receiving inspector / shift leader for fast actions.
perform sap transaction concurrently with the receiving process of the parts.
connect to vendor performance specialist and procurement specialist
engine part/ component with issues shall be quarantined as commercial quarantine at designated quarantine area.
escalate to shift leader for any parts in commercial quarantine has exceeded 48 hours
scanning of incoming document in the scanner and indexing of documentation for easy reference.
to assist on creation of inbound engine, outbound engine, module whenever required.

learning objectives: throughout the duration of the internship, the intern will learn how to: 

identify and define the common business terminology used at the worksite.
solve problems and create value for the organization and stakeholders. 
understand the receiving process and downstream processes in aerospace/ aviation industry.
meet quality requirement / aviation airworthiness requirements.
pay attention to detail and important information.
demonstrate multi-channel communication skills including oral, written, audio/visual and digital.

qualifications / requirements:

diploma in logistics/ transportation or supply chain management or related field. 
moderate in spoken and written english. 
strong teamwork skills.

desired characteristics:

passionate working in a maintenance repair and overhaul shop
strong desire to work in a teaming environment
humble: respectful, receptive, agile, eager to learn
transparent: shares critical information, speaks with candor, contributes constructively
focused: quick learner, strategically prioritizes work, committed  
leadership ability: strong communicator, decision-maker, collaborative
problem solver: analytical-minded, challenges existing processes, critical thinker

additional informationrelocation assistance provided: no",https://www.jobstreet.com.my/companies/ge-aviation-168550975942568/reviews?jobId=75444371,4.3,34
Internship for computer science students,OTC TRAINING CENTRE SDN. BHD.,Shah Alam/Subang,undisclosed,22d ago,19/5/2024,https://www.jobstreet.com.my/job/75440436?type=standard&ref=search-standalone&origin=cardTitle#sol=8a3ccaa97f203cb2ff1d35eb80355ec41d43245a,"responsibilities:· to monitor and maintain regular records of all office administrative operation report· search engine optimization tasks· website design/modification and maintenance tasks additional information• full training is provided• applicants must be willing to work in subang, selangor.• 5 days work per week. we are performance-oriented and are ready to offer an attractive remuneration package that commensurate with qualifications and experience. interested applicants may send your application through email together with your latest resume, stating details of experiences and qualifications together with a recent photo and contact numbers (mobile/telephone) to northern(a)otc.com.my or call james, 012-5882263 .we regret that only shortlisted candidate will be notified.",,,
Management Trainee Internship,WINTOO TECHNOLOGY SDN. BHD.,Puchong,"RM 1,000 – RM 1,200 per month",22d ago,19/5/2024,https://www.jobstreet.com.my/job/75432514?type=standard&ref=search-standalone&origin=cardTitle#sol=7b4c8d7d1cd6504415c2d4b7b0958790b3e008b5,"job descriptionwe are offering an opportunity for you to be part of wintoo, which aims to develop and guide you with the necessary skills and experiences. we are looking at a pool of dedicated and responsible individuals to fill the position of management trainee who will focus on key areas includes sales, product, and backend operations. we will provide the foundational training and development with rotation of each department with the supervision of business leaders and mentors.requirements:-priority given to those who have own transportation.good learning attitude.passionate for giving new ideas provides consultation to customers.customer-oriented, collaborative, and proactive attitude.being initiative will be an added advantage.true team player and out going personality.benefits:-opportunity to learn sales, marketing and management.systematic transparent increment & promotion.systematic business operating system (bos) training will be provided.attractive incentives - cash incentives, festival incentives, games incentives, local & overseas travel incentives.we have an effective training system and the continuous co-creation, sharing and common to promote personal career growth and to achieve each employee's dream.",,,
Procurement Internship,Sound Environment Sdn Bhd,Johor Bahru,RM 800 – RM 850 per month,22d ago,19/5/2024,https://www.jobstreet.com.my/job/75429545?type=standard&ref=search-standalone&origin=cardTitle#sol=ec6f8113e6f295056a2ece063b0dc60d8c592fd0,"procurement internship• responsible for sourcing, selection and negotiate with supplier in term of pricing, quality,delivery, and service to ensure cost effective purchase.• assists for the preparation and processing purchase orders and documents in accordancewith company’s policies and procedures.• monitor and coordinate deliveries of items between suppliers.• maintain database and records.• work closely with the site teammates on collection/delivery and goods moving in/out ofwarehouse.• sourcing for alternate suppliers, as required.• perform other duties as required.job requirements:• experience with ms office• bachelor’s degree in any discipline• good in mandarin and english communication• able to commit for at least 3 months internship duration.• allowances will be given.",,,
Internship For Project,Questcom Solutions Sdn Bhd,Selangor,undisclosed,23d ago,19/5/2024,https://www.jobstreet.com.my/job/75376101?type=standout&ref=search-standalone&origin=cardTitle#sol=e50bf2fd1703c4d73723a9b5730c7d923869c475,"responsibilities: to assist install, test, repair and modify electronic equipment following technical manuals or engineer’s instructions.to assist assemble circuitry for electronic equipment in accordance with technical manual/ specification and engineer’s instructions.to assist test electronic instruments and equipment and repair or replace faulty parts.to assist calibrate electronic measuring and indicating instruments according to established standards.to study drawings and lay-out correct position of electronic controls and devices.to assist test and adjust assemblies, including cables, wiring and electronic controls and adjust safety devices.to assist technician or engineer in providing training clients/ users on correct operating methods for safety reason and to prevent breakdown.to perform any other duties assigned by superior from time to time.basic requirements:academic qualification:  possess certificate /diploma/ degree in electrical/ electronic engineering / mechanical /mechatronics.must have transportation as need to travel multi-site location.",,,
Internship for IT,Improvage Precision Sdn Bhd,Melaka,undisclosed,23d ago,19/5/2024,https://www.jobstreet.com.my/job/75443874?type=standard&ref=search-standalone&origin=cardTitle#sol=7c0a174f420f0ddc9972434abfe49b1f33c18ae2,"description1. technical support: provide assistance to end-users with hardware, software, and network issues. troubleshoot and resolve technical problems promptly to minimize downtime and maintain productivity.
2. project support: assist it team members in various projects such as system upgrades, software implementations, and process improvements.
companyvissionto be the top supplier of the choice in the field of high-quality precision of products, components, and parts for the aerospace industry, semiconductor industry, and automation industry.
missionto continuously improve the business by putting forward new ideas and working very closely with our clients.to create greater value in the area of quality, delivery, competitive price, and services & support.
website: www.improvage.com",https://www.jobstreet.com.my/companies/improvage-precision-168557730637431/reviews?jobId=75443874,3.1,26
"Intern, Project",Teleport Commerce Malaysia Sdn Bhd,Sepang,undisclosed,23d ago,19/5/2024,https://www.jobstreet.com.my/job/75435695?type=standard&ref=search-standalone&origin=cardTitle#sol=d79bbeec51f7c3458b9aacc62fa161dbd1f8d060,"at teleport, we’re on a mission to innovate in a traditional cargo and delivery industry. to enable everyone, from single merchants to the largest companies, to move goods and e-commerce anywhere in southeast asia and beyond. to simply work, like magic. therefore it’s critical to ensure our content is relevant to our potential customers ranging from major
e-commerce players to individuals who want parcels delivered.
we are looking for someone enthusiastic and resilient. as an intern in the cargo strategy & projects team, you will be based out of our office in redq, sepang. you will be expected to be performing this role on a full-time basis. you will be expected to be performing this role on a full-time basis. the role reports to the assistant manager, strategy & projects. you will fit perfectly if you enjoy a fast-paced working environment with passionate colleagues. 
a day in a life
as a start-up, you can expect your days to be pretty varied. multitasking is normal, and sometimes, your skills or natural talents will be leveraged to support other business priorities. that said, the bulk of your working hours should involve you having to:
● document and map out teleport overall revenue recognition and user journey process, collaborating with multiple stakeholders across revenue management, commercial and finance
● identify key points of current process failures and devise and recommend potential remedies to mitigate potential revenue leakages
● maintain an up-to-date repository of all revenue-related documents including but not limited to airwaybill scanned copies and cargo manifests
● ensure that individual gross, chargeable weights and freight rates on individual airway bills are captured accurately in accordance with including but not limited to weight breaks, agent/shipper, commodity code and rate validity
● ensure that monthly cargo sales reports produced by our general sales agents are consistent with actual revenue records
● communicate and resolve any revenue discrepancies and variance with revenue management and finance
requirements
skills
these are minimum-requirement skills and a ‘must-have’ for the role:
● excellent problem solving skills, with a focus on delivering implementable solutions and results
● willingness to work outside their comfort zone and try new things
● proficient in powerpoint, word, and excel
● highly developed oral & written communication skills - especially in english
qualifications & experience
● final year students pursuing degree in finance/ accounting/ statistics/ economics
● willing to commit for a minimum of 3-6 months
● have working experience (would gain extra pointer)",https://www.jobstreet.com.my/companies/teleport-168558469810277/reviews?jobId=75435695,3,3
IT Internship,Vision Technology Consulting Sdn Bhd,Kuala Lumpur,undisclosed,24d ago,19/5/2024,https://www.jobstreet.com.my/job/75397128?type=standout&ref=search-standalone&origin=cardTitle#sol=2adc3144bc2be9840f4b542d326bf4388cb7bf3e,"responsibilities:analysis & design of enterprise software application, data model, integration and/or server architecturecoordinate, plan and deliver on all tasks related to systems infrastructure design, installation configuration, administration, across all environments.prepare functional, technical, integration and/or server architecture design specificationssoftware configuration, development & customizationperform operational tasks and activities (e.g. application monitoring, performance tuning and migration between environments)implements & govern code migration processes to reduce risks in projectprovide application supportassist with solving technical problems when they ariserequirementscandidate must possess at least a bachelor's degree, post graduate diploma, professional degree in computer science/information technology or equivalent.no prior working experience is required. training will be provided.fresh grad and interns are encouraged to applyexcellent oral and written communication skills.flexible to work in various work location depending on customer site. kl/pjable to work shifts and weekend upon client request.candidate is required to provide cv, coursework transcript & fyp report upon internship interview confirmation.",https://www.jobstreet.com.my/companies/vision-technology-consulting-168556302349916/reviews?jobId=75397128,3.6,17
