JobTitle,company,location,salary,date_posted,ExtractDate,job_url,summary,review_url,overall_rating,num_ratings
Internship for IT / Computer Science Student,I Concept Solutions (M) Sdn. Bhd.,UEP Subang Jaya,RM 600 – RM 800 per month,1d ago,19/5/2024,https://www.jobstreet.com.my/job/75961827?type=standout&ref=search-standalone&origin=cardTitle#sol=bc7e6779f4e010cd9d929b2deb8d5afb6fda770c,"job descriptionwe are seeking talented programmer students to join our internship programme. you'll have the opportunity to work on real-world projects, learn from experienced developers, and build your skills in programming languages such as php, html and mysql. you'll also get to collaborate with a team of developers and contribute to the development of innovative website solutions.job requirementscurrently enrolled in a degree programme in it/computer science or a related fieldat least 4-6 months internship duration is preferredbasic programming skills in php / html / mysqlpassion for technology and software developmentwillingness to learn and take on new challengesstrong problem-solving and analytical skillsgood communication and teamwork abilitieswillingness to work at our location in one city, subang",,,
IT Network & Support Internship,EBIZNESS SOFTWARE SDN. BHD.,Bandar Sri Damansara,undisclosed,1d ago,19/5/2024,https://www.jobstreet.com.my/job/75959955?type=standout&ref=search-standalone&origin=cardTitle#sol=130826c44389a0da24e617a61e33923070f80b0e,"job descriptionsinstalling, configuring, troubleshooting and managing windows server, pc, hardware, os, networking, cloud, remote desktop/vpn, settings, etcperforming routine backup and understands the importance of backupassist in software and application system support as well follow up and reply to emails according to our sla (service level agreement).willing to learn, training and hands-on guidance will be providedcareer growth opportunity requirementsinternship candidates in networking or it, technical support - hardware/software  or equivalent are welcome minimum 6 months internship period as training and hands-on guidance will be provideddiploma or fresh graduate in information technology / networking / computer science or any equivalent are encouraged to apply as wellunderstands networking, server and computer setup and installation, windows server & os, dns, email, tcp/ip, etc.passion/ knowledge in areas such as cloud, vpn, desktop computing, vm, servers, web-based systems, etcgood communication and being able to work as a teambasic conversation in mandarin or cantonese is a bonus able to be based at bandar sri damansara (mrt station within 10-15mins walk)",,,
Internship - Production,Technip Energies,Iskandar Puteri,undisclosed,1d ago,19/5/2024,https://www.jobstreet.com.my/job/75962255?type=standard&ref=search-standalone&origin=cardTitle#sol=8fe30e2408fe8b29471bdefcaaa407141debfb28,"• assembles, tests, paints surface components following standard specifications.
• completes required test documentation including test reports, failed test reports and non-conformance reports (ncr).
• uses material handling equipment to move parts, components and subassemblies from one work or storage area to another as required.
• understand and follow all safety requirements and procedures",,,
Internship - Machining 1,Technip Energies,Johor Bahru,undisclosed,1d ago,19/5/2024,https://www.jobstreet.com.my/job/75962329?type=standard&ref=search-standalone&origin=cardTitle#sol=6634aa06190bac9f429c3de44208c801366963af,"• performs necessary mechanical repairs and maintenance on equipment and facilities
• supports the delivery of materials, equipment and supplies to meet project needs
• equips and deploys inventoried tool trailers for use by operation teams
• assists with warehouse inventory control and tracking system
• ensure stockroom duties such as counting and categorizing parts
• ensure general housekeeping duties such as trash removal, floor sweeping or snow removal",,,
Internship (June 2024-December 2024),Press Metal Aluminium Holdings Berhad,Shah Alam/Subang,"RM 1,000 – RM 1,200 per month",2d ago,19/5/2024,https://www.jobstreet.com.my/job/75948549?type=standout&ref=search-standalone&origin=cardTitle#sol=2e6c0119240dae0eb92bd3ea564e93e574478e61,"hi there!we are currently looking for passionate and energetic interns who are keen to join us in a mnc with operations in more than 6 countries. as one of the world’s leading public listed companies, press metal plays a key role in meeting the world’s aluminum supply in economically, environmentally, and socially responsible ways.would you like to become part of the world’s most fast growing company?put your academic knowledge to the test now!who we need:the roles of:-sustainabilityinternal auditinformation technologyrisk managementsales adminwhat you will get :attractive allowanceregional & global stakeholder exposureattractive benefits (gym, free parking)work life balanceas a press metal intern, you will also:-gain hands-on experience while working alongside our team of experts in the field.learn crucial soft skills such as communications, critical thinking, teamwork, project management, time management, multitasking and etc; as well as technical skills.experience a flat organization culture that is transparent, open and equal, which means you can walk up to anyone in the office for guidance, advice or to share ideas too.what will make you successful:possess a diploma / degree that is either relevantactive involvement in extra co-curricular activities in universityproficient in writing and communicating in englisha great team player with excellent interpersonal and communication skillsinternship for 4 months minimum would be an added advantage.how to apply:please apply with your updated resume, stating your academic achievement and extra-curricular activities and indicating internship start & end date. incomplete applications will not be entertained. only shortlisted candidate will be notified.",https://www.jobstreet.com.my/companies/press-metal-168554256865716/reviews?jobId=75948549,3.8,94
Internship - Workplace (for Computer/IT Students),CTC Global Sdn Bhd,Petaling Jaya,undisclosed,2d ago,19/5/2024,https://www.jobstreet.com.my/job/75948300?type=standout&ref=search-standalone&origin=cardTitle#sol=f361c673c2f3f3826b8d28ceeb9e8f37bf7a9187,"important: please indicate your internship period (start & end date of internship). minimum 3 months & above. during the internship period, you will be exposed to these areas:role & responsibilities:installation, troubleshoot and configure of pc, notebooks, printers, scanners hardware components.installation, troubleshoot and configure of microsoft window operating system and microsoft applications in the desktop and notebook.installation and troubleshoot mcafee anti-virus software, patches and hot-fixes for ms or other applications.data analysis.creation of new pc image, support ca deployment and mcafee agents requirements:candidate must possess or currently pursuing a diploma or bachelor's degree in computer science/ information technology or equivalent.preferred skill(s): windows operating systems, microsoft desktop applications.passionate, fast-learner, good communication & inter-personal skills.applicant must be willing to accept the above internship scope.applicant must be willing to travel within klang valley and best possessing own transport.internship period: must be minimum 3 months & above.",https://www.jobstreet.com.my/companies/ctc-global-168556940778711/reviews?jobId=75948300,3.4,77
Internship - Business Consultant,Hitachi eBworx Sdn. Bhd.,Petaling Jaya,undisclosed,2d ago,19/5/2024,https://www.jobstreet.com.my/job/75945829?type=standout&ref=search-standalone&origin=cardTitle#sol=798bde0d2a4854b889228d7e116febc27fae4abf,"responsibilities:• assist in documenting user requirement, develop test scripts, user guides and training materials• assist in functional testing to ensure system conformance to requirement.• work closely as a team to ensure the functional requirements are developed into the application. requirements:• degree in business management/engineering/computer science/information technology or its equivalent.• preferred students with a minimum cgpa of 3.0.• those with minimal programming background will have an advantage.• excellent written and oral communication skills in english. proficiency in national language will be an added advantage.• detail oriented, have a passion to learn and is committed to self-improvement.• adaptable, able to work independently as well as in a team.",https://www.jobstreet.com.my/companies/hitachi-ebworx-168554357820170/reviews?jobId=75945829,3.3,62
Project Coordinator - Internship 6months,CENTIFIC GLOBAL SOLUTIONS (M) SDN. BHD.,Bandar Dato'Onn,undisclosed,2d ago,19/5/2024,https://www.jobstreet.com.my/job/75944854?type=standard&ref=search-standalone&origin=cardTitle#sol=85fdddfba3d951bd538bbc80aaee904db1030568,"the project coordinator intern is responsible for assisting in any low-level task required by project managers. they are temporary employees that work for a set amount of time, usually as a learning experience. project coordinator interns can perform work in a variety of roles such as evaluators, annotators, or quality specialists. they do whatever is needed to meet the project needs. entry-level position. duties and responsibilities• employment temporary, can lead to permanent employment.• using employment as a learning opportunity.• usually, recently graduated or still attending college/university.• assists in whatever low-level tasks required by pm(s).• follows all guidance from pc(s) on project work.• responds to ambiguities/changes/updates from pc(s) in a timely manner.• meet or exceed all daily, weekly, and monthly kpis pertaining to the specific process flow of the assigned project.• additional duties as required. requirements• basic familiarity with microsoft office 365 including outlook, excel, and powerpoint.• general knowledge of online communication.• willingness to work overtime if necessary.• in office work environment.• employment tied to a specific project.• ability to follow directions and perform time-bound tasks accurately and efficiently.• ability to perform repetitive tasks without degradation in quality.• detail-oriented problem-solving mindset.• organized and focused enough to work independently as a role player within a team environment. about centific  centific is a global digital technology services company with solutions across various industries. led by a people-first, intelligence-driven approach, centific enables experiences that help brands thrive in a sustainable and meaningful way, working to create long-term value and loyal customers for our clients – now and in the future. with clarity of vision, technological expertise, and operational excellence, centific is the partner of choice for those who want to run smarter - and those who want to change the race.  our diverse team of over 3,800 people works to deliver on the promise of technology and human-centricity every day. are you ready to start solving today’s industry-specific challenges with tomorrow’s cognitive technology? lets talk.  your authentic self at centific  centific is an equal-opportunity employer. all qualified applicants will receive consideration for employment without regard to race, color, religion, national origin, ancestry, citizenship status, age, mental or physical disability, medical condition, gender (including pregnancy), gender identity or expression, sexual orientation, marital status, familial status, veteran status, or any other characteristic protected by applicable law. we consider qualified applicants regardless of criminal histories, consistent with legal requirements.",,,
Software Engineer (Internship),Optimai (Malaysia) Sdn Bhd,Kuala Lumpur,undisclosed,2d ago,19/5/2024,https://www.jobstreet.com.my/job/75932599?type=standout&ref=search-standalone&origin=cardTitle#sol=00ba3eb50fad9c89e187edbc4145522ff582e638,"we are looking for software engineering interns who are passionate in finance & investments to join us in our drive to become the leading fintech company in asia:business intelligence / data analyticsbackend developmentsoftware testing and automationgenerative ai / machine learningweb & mobile frontend developmentdevops ci/cd cyber securitysystem & server adminyou will enjoy working with a close-knit team of friendly colleagues to create innovative, state-of-the-art financial systems from front office trading to middle and back office systems for stockbrokers, fund management companies, banks & exchanges.through our rapid enterprise application platform (reap), you will help transform the way enterprise systems are built in the future. technicalbusiness intelligence / data analytics - tableau / power bi / devexpress / sql / etc.backend development - database design, sql programming, performance optimization (microsoft sql server), rest apis, wcf, python, etc.software testing & automation - black/white box testing, automated testing, sql, apisgenerative ai / machine learning - chatgpt, embeddings, vector databases, classification, association, time series prediction using ml techniques, etc.web / mobile frontend development - .net core, mvc, javascript, next.js, react, rest apis, etc.devops ci/cd - experience with ci/cd tools (jenkins, gitlab ci or azure devops), containerization and orchestration tools (dockers, kubernetes), cloud services (aws, azure, gcp) and serverless architecturescyber security - proficiency with security audit tools, intrusion detection systems, knowledge of secure coding practices, ethical hacking and firewall management, familiarity with compliance frameworks such as iso 27001, nist, gdprsystem & server admin - ad, sccm, backup & restore, it security, hyper-v, azure, awsbusinessfinancial industry - capital markets, wealth management, bankinginvestment data warehouse & portfolio analytics, stock trading, margin financing, portfolio financing, securities borrowing & lending, contracts for difference, leveraged fx, loans & syndicated loans, crypto assets, private equity, factoring & supply chain financing",,,
Internship - Auto Selection Kuala Lumpur,Sime Darby Motors,Petaling Jaya,undisclosed,2d ago,19/5/2024,https://www.jobstreet.com.my/job/75929452?type=standard&ref=search-standalone&origin=cardTitle#sol=a837b4be917c87443ff73502905e5769cfe483e1,internship placement for 2024 intake!internship for administrationability and practices of filing and record keeping.methods and techniques of word processing.knowledge of business letter writing and basic report preparation.advantagesyou will have real experience and practice in the field of office administration.have a chance to work with us after finishing your internship or graduation.requirementscandidate must possess at least a diploma/advanced/higher/graduatediploma in administration or equivalent.minimum 3 months of the internship periodno work experience is required.candidate must possess own transport.a monthly allowance is provided.,https://www.jobstreet.com.my/companies/sime-darby-motor-group-168490909591702/reviews?jobId=75929452,4.3,30
Internship,Panasonic Manufacturing Malaysia Berhad,Shah Alam/Subang,undisclosed,2d ago,19/5/2024,https://www.jobstreet.com.my/job/75928576?type=standout&ref=search-standalone&origin=cardTitle#sol=3e35c3e01f264967e90da1c335a1910694689b87,"job description:working closely with the supervisor to complete all assignments given.support supervisors on data analysis as required by the department.follow up the request from external / internal customers.talk / liaise with various departments to collect and compile data.summarize and prepare the reports by using ms excel/ms power point.other tasks assign by supervisor. job requirements:candidate must possess at least a diploma, advanced/higher/graduate diploma, bachelor's degree, post graduate diploma, professional degree, related to business administration, economics, international business, mechanical engineering, electronic engineering or equivalent.required skill(s): ms excel, ms power point, good communication skillapplicants must be willing to work in seksyen 15 or seksyen 23, shah alam",https://www.jobstreet.com.my/companies/panasonic-168559066436433/reviews?jobId=75928576,3.8,235
"Internship (IT, Accounts)",SEA ASIA PACIFIC SDN. BHD.,Simpang Ampat,RM 600 – RM 900 per month,2d ago,19/5/2024,https://www.jobstreet.com.my/job/75928450?type=standout&ref=search-standalone&origin=cardTitle#sol=cb83a9ec6062b3958c655c594e0509b279227db9,"information technology (it) intern responsibilities:provide technical assistance to staff and customers on hardware and software-related issuesinstall, configure, and troubleshoot computer systems, hardware, and softwaremonitor system performance and troubleshoot any issuesfollow established procedures and processes for computer maintenanceprovide training and support to team members on the use of computer systems and softwareperform system backups and maintain accurate recordsresearch and recommend solutions for technical problemsaccounting intern responsibilities:shadowing members of the accounting department as they perform their duties.assisting with research, filing, data entry, and recording and maintaining accurate and complete financial records.help in preparing financial reports, such as balance sheets and income statements, invoices, and other documents.working with sql software.learning how to work as part of the accounting team to compile and analyze data, track information, and support the company or clients.",,,
Internship for IT Department (Computing/Software),Jabil Sdn Bhd (Global Business Center),Penang,"RM 1,000 – RM 1,200 per month",2d ago,19/5/2024,https://www.jobstreet.com.my/job/75925443?type=standout&ref=search-standalone&origin=cardTitle#sol=081e5eba5e69a38ed998b30b4fd487b5b0927230,final year students are welcome to apply for this position.candidate must possess or currently pursuing a bachelor's degree in computer science/computer engineering/software engineering/data science engineering/ai etc.please indicate your internship start and end date (duration # of weeks) in your application.,,,
Internship for Engineering Students,NORMA Products Malaysia Sdn Bhd,Ipoh,"RM 800 – RM 1,000 per month",3d ago,19/5/2024,https://www.jobstreet.com.my/job/75916015?type=standard&ref=search-standalone&origin=cardTitle#sol=6cd7b7918c491b2dc4921e1b00a04ea99184db0b,"what you will experience:throughout your internship at norma, you are expected to apply your theoretical knowledge in an actual world setting. you will be given an opportunity to prove yourself through challenging assignments. during your internship at norma, you will gain invaluable work experience, skills and knowledge that will form a solid foundation in your career.we believe strongly in continuous learning and development. as an intern, you will be provided not only with on-the-job training, but also mentoring and coaching by your supervisors. finally, an internship with norma group will show you what the world's leading engineered joining technology company is like from the inside.what we look for:currently pursuing a bachelor degree (in any engineering) in a recognized institution of higher learning, with good academic achievements above 2.75/4.00 cgpa.self-motivated with good demonstrated leadership and communication skills.strong technical attributes (e.g. attention to details, highly organized and good math/analytical skills).** pease indicate your internship duration & time in your resumedo note that only shortlisted candidates will be contacted.",https://www.jobstreet.com.my/companies/norma-products-malaysia-168551788795809/reviews?jobId=75916015,3.4,8
Internship (Web Developer),EasyParcel Sdn. Bhd.,Bayan Lepas,RM 750 – RM 800 per month,3d ago,19/5/2024,https://www.jobstreet.com.my/job/75906016?type=standout&ref=search-standalone&origin=cardTitle#sol=3c02434d87debcad232f137369d38514ff094b29,key responsibilities:collaborating with other designers and developers.improve our inhouse code base.optimize codes for high volume transaction.test and debug applications.research on new technologies (a better and easier way to solve the same problem). requirements:able to code and interested in code.willing to explore and learn.love to solve problems with coding.like to brainstorm for better solutions.has high level of accountability to the result and code produced.has ability to learn and adapt to new technologies.knowledge on git/jira is added advantage.,https://www.jobstreet.com.my/companies/easyparcel-168553705191024/reviews?jobId=75906016,4.4,27
Assistant Professor - Computer Science,USMC Sdn. Bhd.,Iskandar Puteri,undisclosed,3d ago,19/5/2024,https://www.jobstreet.com.my/job/75934366?type=standard&ref=search-standalone&origin=cardTitle#sol=1b723cb420613232530c8d8b19f4ea6bfb2e0bba,"descriptionto undertake research in line with the uosm research strategy, to teach and supervise at undergraduate and postgraduate levels, and to undertake relevant leadership, management and engagement activities. carry out administrative tasks associated with specified research funding, for example risk assessment of research activities, organisation of project meetings and documentation. implementation of procedures required to ensure accurate and timely formal reporting and financial control. develop and carry out an area of research in line with the uosm research strategy.
companymission - to change the world for the bettervision - the university of southampton malaysia will be a leading university for education, research and industry engagement across asia. our current engineering excellence will provide the platform for inspiring the most talented minds to change the world for the better.",,,
Site IT Experience Intern,Roche Services & Solutions Operations APAC,Petaling,undisclosed,3d ago,19/5/2024,https://www.jobstreet.com.my/job/75901972?type=standard&ref=search-standalone&origin=cardTitle#sol=d69d244cd7b9df5e6572ba9105fc8e03201102be,"roche fosters diversity, equity and inclusion, representing the communities we serve. when dealing with healthcare on a global scale, diversity is an essential ingredient to success. we believe that inclusion is key to understanding people’s varied healthcare needs. together, we embrace individuality and share a passion for exceptional care. join roche, where every voice matters.
the position
assisting to complete the sop documentation for the team while shadow learning from the site it operations specialist.
new floor setup of it equipments
new hire it onboarding tasks
assisting for it asset management which includes stock count, migration of data to new asset management tool and asset management documentation
assisting as a backup for site it operations specialist for daily task on handling user issues.

who we areat roche, more than 100,000 people across 100 countries are pushing back the frontiers of healthcare. working together, we’ve become one of the world’s leading research-focused healthcare groups. our success is built on innovation, curiosity and diversity.
the roche services & solutions as well as people support solutions organisations located in kuala lumpur provide end-to-end business solutions for finance, procurement, it, communications, people & culture (human resources) and beyond to our roche colleagues across the apac region. today roche employs altogether around 1100 employees in malaysia. 
roche is an equal opportunity employer.",https://www.jobstreet.com.my/companies/roche-168553946317737/reviews?jobId=75901972,4.1,50
Internship (Intake May & onward),Celestica Electronics (M) Sdn Bhd,Senai,"RM 1,500 per month",3d ago,19/5/2024,https://www.jobstreet.com.my/job/75897447?type=standout&ref=search-standalone&origin=cardTitle#sol=d9c59bb256574d97ec7416b14e2afd6bc37db9c8,"job description:will be given to shortlisted candidates once contacted. knowledge/skills/competencies:knowledge of computer applications such as word, excel, powerpoint and multiple business applications.basic understanding of customer needs.good analytical and statistical skills.ability to handle multiple tasks while maintaining attention to detail.requirements:degree/ diploma holder in any engineering, human resource, supply chain management/logistic, business administration, operations management, technology management or related field.minimum 4 months internship durationwork location: celestica senai, seelong, tampoikindly include latest cgpa, internship start & end date in resume or cover letter.",https://www.jobstreet.com.my/companies/celestica-168551534294891/reviews?jobId=75897447,4.2,171
Internship for Various Department,SUZUKI MALAYSIA SDN. BHD.,Glenmarie,RM 400 per month,3d ago,19/5/2024,https://www.jobstreet.com.my/job/75893092?type=standard&ref=search-standalone&origin=cardTitle#sol=aa7b63a73709eb09e1adeb1d05ea02a60488ee3c,"suzuki malaysia sdn bhd is currently looking for young, dynamic, and energetic students for internship placement. departments available: logisticsfinance & accountsplanningadmin workshopservicegeneral affairs spare partmarketinghuman resourceproductiongovernment & institution salessales training  requirements: currently pursuing study diploma/degree in business admin/international business/e-commerce/marketing or any related.currently pursuing study diploma/degree in engineering/mechanical engineering/automotive/production or relevant courses.fast learner, good attitude, willingness to learn and perform extra miles.good communication skills.good in computer skillsable to work at glenmarie, shah alamhave transportation to work.",https://www.jobstreet.com.my/companies/suzuki-malaysia-168557319489546/reviews?jobId=75893092,3.6,12
