JobTitle,company,location,salary,date_posted,ExtractDate,job_url,summary,review_url,overall_rating,num_ratings
Internship - IT Quality Assurance Analyst,Hilti (Malaysia) Sdn Bhd,Petaling,undisclosed,30d+ ago,19/5/2024,https://www.jobstreet.com.my/job/74969065?type=standard&ref=search-standalone&origin=cardTitle#sol=0a39d61633bd65112aca0ebaadb6034c18b55968,"what's the role?
join us as an intern in our it team and you will work on exciting projects ranging as an it quality assurance analyst. as a member of our international and multidisciplinary team, you will gain experience in global it project and solution management, improve your practical expertise, and solve real-life challenges in an international enterprise. 
the start date for the internship is flexible to the student's availability with a duration of at least 4-6 months.
who is hilti?
hilti is where innovation is improving productivity, safety and sustainability in the global construction industry, and beyond. where strong customer relationships are creating solutions that build a better future. where there is pride and a sense of belonging across our 120 locations, carrying right into our lives and homes. where people are exploring possibilities, leveraging their potential, owning their personal development and growing lasting careers. 
global it within hilti is a truly global team with main hubs in buchs (switzerland), kuala lumpur (malaysia) and plano/tulsa (usa). all locations have highly competent teams who work very closely together. hilti`s global it team is known for their focus on sustainable value creation by translating latest it innovations into value creating solutions & services.
what does the role involve?
 quality assurance (qa)  is a key disciple in it product and solution creation. be part of the journey, to refine our qa processes in terms of way of working and testing approach within the software development lifecycle (sdlc) of global it. 
in order to ensure both new and existing features on our it platform are up and running, you will define, design and review test cases to be executed. together with a team of qas, we look to ensuring quality in terms of functionality, performance, security and user experience (ux). 
last but not least, you will monitor all stages of software development and configuration to identify and manage malfunctions; bring transparency on quality status and look into continuous improvement in way of working, to meet our quality standards.

 we have an excellent mix of people, which we believe makes for a more vibrant, more innovative and more productive team.
 
what do we offer?
show us what you’re made of and we’ll offer you opportunities to move around the business – to work abroad, experience different job functions and tackle different markets. it’s a great way to find the right match for your ambitions and achieve the exciting career you’re after.  we have a very thorough people review process, unlike any we know of in any other business. we can pair talent with opportunities - developing our people in their current roles or challenging them to work in new ways or in new places. it’s how we find the right fit, further our teams personally and professionally, get the best value for each employee and increase the job satisfaction. additionally, we offer you a wide range of benefits.
what you need is:
  you are currently enrolled in bachelor's / master's, or studies in information technology/ software engineering / data science / computer engineering, or related fields.   your strategic approach and good problem-solving skills are paired with proactiveness and a hands-on mentality.   you have strong communication skills and interpersonal skills and you are fluent in written and spoken english.   you are eager to learn and challenge yourself.  
why should you apply?
become a valuable member of our highly professional and international team of it experts and meet the challenges of a global multinational company using latest technologies. you will have the freedom to act in the responsible area with career prospects in a dynamic environment, excellent opportunities to develop yourself to higher levels and wider range of knowledge. our team in kuala lumpur is a fully recognized and respected competence center that is covering all relevant areas of it. 80% of the top positions are filled internally. we have a clearly defined career development track for every individual employee and an excellent team which are duly rewarded by performance.
click through the 'apply now' button where you will be asked to upload your cv and answer a couple of short questions–the whole process should take around 90 seconds. if we like what we see, you'll be invited to a telephone interview.  if we don't have a suitable role for you at the moment, we will keep you in our talent pool for the future so your recruitment process might take a bit longer but we'll be sure to stay in touch. 
#joinhiltiasiaitservices  looking forward to hearing from you!",https://www.jobstreet.com.my/companies/hilti-168553012630402/reviews?jobId=74969065,4.3,116
Ignite Internship - E-commerce (April 2024),L’Oréal Malaysia Sdn Bhd,Petaling,undisclosed,30d+ ago,19/5/2024,https://www.jobstreet.com.my/job/74934094?type=standard&ref=search-standalone&origin=cardTitle#sol=6d56b6d47a45c2d1dca0c77f59cc95ae59504392,"our ignite internship program is open to students in universities, business and engineering schools from diverse backgrounds and provides the opportunity to acquire substantial initial work experience in the e-commerce department in our consumer product division (garnier, l'oréal paris, maybelline)
for three to six months you become a member of a team of professionals in your own right, working on actual missions and achieving concrete objectives on which you are assessed. you develop your skills while fully expressing your personality and qualities. above expertise or qualifications, we are looking for proactive, enthusiastic and ambitious talent, capable of fully committing to projects, changing enthusiasm into success and creating beauty & excellence. this internship is your best preparation yet to become one of our future business leaders and join our management trainee program
an integration programme
whatever the outcome of your internship you will have benefitted from a unique professional experience before beginning your working life. to facilitate your integration into l'oréal and your team, with the help of your supervisor, we offer:
* real projects for you to work on
* meaningful work 
* build professional connection & network
the intake will be for april 2024.",https://www.jobstreet.com.my/companies/loreal-168552615911551/reviews?jobId=74934094,2.7,6
Sarawak Energy Internship Programme 2024 (Intake July to September 2024),Sarawak Energy Berhad,Sarawak,undisclosed,30d+ ago,19/5/2024,https://www.jobstreet.com.my/job/74960771?type=standard&ref=search-standalone&origin=cardTitle#sol=0216bd49f403b6e96f32a00377220fbc0d679b77,"external open resourcing
location:  malaysia (my), all operating units within sarawak
company: sarawak energy berhad
number of openings: 200 
closing date: 1 july 2024
-------------------------------------------------------------------------------------------------------------------------------------------
we invite all eligible and qualified students in their final year of diploma or first degree at universities, colleges, or polytechnics to apply for sarawak energy internship programme to gain valuable on-the-job experience opportunity.
our objectives: 

provide students with opportunities to gain work experience and apply specific technical skills and knowledge learnt in universities to meet their curricular requirements
help students to be employment-ready by creating linkages between education, training and work through capability building
identify talents for recruitment into sarawak energy’s competitive graduate talent pool
part of sarawak energy’s integrated workforce planning (iwp) resourcing strategy to assist in the delivery of business priorities

focused disciplines:

engineering (electrical/mechanical/civil)
occupational health & safety
finance/accounting
law
information technology
human resources management
business administration
communication/multimedia
social science/sustainability

requirement:

full-time student
possess at least a cumulative grade point average (cgpa) of 3.30 or equivalent
minimum 10 weeks of internship duration
eligible applicants must be enrolled in a graduate programme (diploma, bachelor's degree, master's degree or equivalent) at the time of application

required documents: 
all applicants must include the following documents in their application:

internship letter from university/college/polytechnic
updated resume
latest cgpa results
one photocopy of mykad

terms and conditions:

sarawak energy does not provide accommodation. all expenses will be borne by the respective students. however, you will be entitled to receive monthly allowance during the duration of your internship.
application must be submitted two (2) months prior to the commencement of internship period.

-------------------------------------------------------------------------------------------------------------------------------------------
our internship programme is open to all malaysians, however, preference will be given to sarawakians.",https://www.jobstreet.com.my/companies/sarawak-energy-168554082816700/reviews?jobId=74960771,4.6,64
Internship - Quality & Compliance,Technip Energies,Johor Bahru,undisclosed,30d+ ago,19/5/2024,https://www.jobstreet.com.my/job/74767952?type=standard&ref=search-standalone&origin=cardTitle#sol=fab0b6ee7caffd0c3c1daae76c4f28068ac48b88,"• prepares different reports related to the work processed, drawing data from a variety of identified sources within and outside of the department
• prepares special reports and analyses within prescribed guidelines/ instructions
• regularly contacts vendors, suppliers, or employees outside the immediate work.
• assembles relevant data and compiles information as directed
• organizes and maintains files of correspondence and records, following up on pending matters
• receives and screens telephone calls, letters, and/or visitors, answering routine questions and providing information
• schedules appointments and coordinates arrangements for meetings, conferences, travels and related issues
• organizes and expedites flow of work through supervisor's office and initiates any follow-up action",,,
Intern student - Purchasing,Continental Automotive Components Malaysia Sdn. Bhd,Alor Setar,undisclosed,30d+ ago,19/5/2024,https://www.jobstreet.com.my/job/74712522?type=standard&ref=search-standalone&origin=cardTitle#sol=6234d9b7f2b9919d1add4e8b64b38600cb4aa00d,"continental develops pioneering technologies and services for sustainable and connected mobility of people and their goods. founded in 1871, the technology company offers safe, efficient, intelligent and affordable solutions for vehicles, machines, traffic and transportation. in 2021, continental generated sales of €33.8 billion and currently employs more than 190,000 people in 58 countries and markets. on october 8, 2021, the company celebrated its 150th anniversary.
 
 
 read more
 
 
 read less",https://www.jobstreet.com.my/companies/continental-ag-168553380227925/reviews?jobId=74712522,4,47
Salesforce Internship,Continental Automotive Components Malaysia Sdn. Bhd,Petaling,undisclosed,30d+ ago,19/5/2024,https://www.jobstreet.com.my/job/74712188?type=standard&ref=search-standalone&origin=cardTitle#sol=8c86d13158f2e1438ce313efdca9d8cf54b5119e,"we are offering salesforce internship program. main tasks is to assist with implementation, customization and maintenance of salesforce solutions, supporting users, conducting data analysis, and participating in project meetings. other responsibilities may include creating reports and dashboards, troubleshooting issues and learning about various aspects of salesforce administration and development. the internship program is based in petaling jaya, malaysia and working together as part of the global competence center of ecommerce, fleet solutions & data science.

assisting with salesforce configuration - this includes setting up new fields, workflows, validation rules and other configuration tasks within the salesforce platform
supporting users - responsible for providing support to end-users, answering questions and troubleshooting issues related to salesforce platform
data management - work on data cleansing, data migration, and data quality initiatives within salesforce. this includes using tools like data loader, excel, etc
documentation and training - tasked with documenting processes, creating user guides, or even conducting training sessions for new salesforce users
working closely with other team members, such as salesforce administrators, developers, business analyst and stakeholders to support ongoing project and initiatives
problem solving - expected to analyze issues, propose solutions and implement fixes within the salesforce environment

 
 
 read more
 
 
 read less",https://www.jobstreet.com.my/companies/continental-ag-168553380227925/reviews?jobId=74712188,4,47
"Internship Information Technology (IT), (Quarter 1/ Quarter 2, 2024 Intake)",Petrofac Engineering Services (Malaysia) Sdn Bhd,Kuala Lumpur,undisclosed,30d+ ago,19/5/2024,https://www.jobstreet.com.my/job/74727699?type=standard&ref=search-standalone&origin=cardTitle#sol=7426faa6dcb8fe9fe4e62cf4c1b26594cad93589,"petrofac is a leading international service provider to the energy industry, with a diverse client portfolio including many of the world’s leading energy companies.  
we design, build, manage and maintain infrastructure for our clients. we recruit, reward, and develop our people based on merit regardless of race, nationality, religion, gender, age, sexual orientation, marital status or disability. we value our people and treat everyone who works for or with petrofac fairly and without discrimination.  
  
the world is re-thinking its energy supply and energy security needs, planning for a phased transition to alternative energy sources. we are here to help our clients meet these evolving energy needs.  
this is an exciting time to join us on this journey.     
  
we support flexible working requests and have adopted a hybrid approach for most of our office-based roles. 
  
are you ready to bring the right energy to petrofac and help us deliver a better future for everyone?   
  
  **please provide us the supporting letter from university/ college stated on the duration of the internship. 
  
job title: internship information technology
key responsibilities:  


support the it team in maintaining hardware, software, and other systems. assist with troubleshooting issues and provide technical support.


support offshore / onshore telecommunication, info security solution & services.


provide erp support for business user requirements & processes. 


essential qualifications and skills:  

bachelor of information technology or computer science
minimum cgpa 3:00
prefer with 6 months and beyond duration.
proficiency in computer applications.
ability to effectively collaborate and work in a team-based environment.
ability to respond effectively to issues and requests and provide technical support.

strong speaking and writing skills.",https://www.jobstreet.com.my/companies/petrofac-168551199560669/reviews?jobId=74727699,4,33
Internship For Computer Technician,Company Confidential,Kuala Lumpur,undisclosed,30d+ ago,19/5/2024,https://www.jobstreet.com.my/job/74673615?type=standard&ref=search-standalone&origin=cardTitle#sol=1a5c8395422cd31fba6701eea6557fcaa71f39bb,"back to home




success",,,
IT Internship,DXC Technology Malaysia Sdn Bhd.,Petaling,undisclosed,30d+ ago,19/5/2024,https://www.jobstreet.com.my/job/74605694?type=standard&ref=search-standalone&origin=cardTitle#sol=4255a644582c5c8d260637cb506eef955dccc21c,"job description:
dxc technology is a fortune 500 global it services leader. our more than 130,000 people in 70- plus countries are entrusted by our customers to deliver what matters most. we use the power of technology to deliver mission-critical it services across the enterprise technology stack to drive business impact. dxc is an employer of choice with strong values, and fosters a culture of inclusion, belonging and corporate citizenship.
start your career with a company that is passionate about developing and nurturing talent in a high-performance culture. 
under the dxc's internship program, you will be equipped with the necessary skillset and knowledge to better prepare you in securing your ideal job, especially in the digital space. 
security – knowledge of client-server applications, multi-tier web applications, relational databases, firewalls, vpns, and enterprise anti-virus products. strong understanding of security incident management, malware management and vulnerability management processes. 
modern workplace – knowledge in software and hardware troubleshooting. respond to service, product, technical, and customer- relations questions. 
ito– knowledge of the following technologies such as wintel, unix, virtualization, cloud. 
requirement:

proficient in microsoft office.
knowledge in desktop operating systems, various software applications and basic hardware for the pc; principles and theories of network systems and internet technology.
good oral and written communication skills and ability to establish and maintain effective working relationship.
ability to coordinate several diverse job requirements and projects.
ability to identify, research problems and resolve user issues.

must be currently enrolled in a degree or diploma program (any computer related program) at college or university intake: april 2024 /july 2024/ oct 2024/ jan 2025                                         duration: 6 monthseligibility: malaysian citizen                     work arrangement: hybrid 

our culture and benefits: dxc is committed to building better futures for our customers, colleagues, environment, and communities. we take care of each other and foster a culture of inclusion, belonging and corporate citizenship. we put this to action developing and implementing societal initiatives within our social impact practice.
#wearedxc as an employer of choice, our “people first” philosophy means we offer competitive remuneration, benefits, training and career opportunities that reflect our commitment to improving the lives of our employees, and the communities in which we live and work. some of these include;


extensive resources to support your onboarding and continual development including dxc university
dxc recognition, our global virtual platform that fosters a culture of appreciation and celebration with real-time reward and recognition
we know that great people refer great people. we will reward you when you bring your friends and family to work at dxc
more time to do the things you love with flexible leave options, including purchased leave
take time to give back with charitable and emergency services volunteer days
well-being matters to us and our employee assistance program is there to support you and your family


how to apply & our commitment to you in return: if you would like to be part of a culture that drives innovation, delivers results, rewards performance and encourages ideas, then please press the ""apply now"" button to submit your resume. in return, we agree to ensure a hiring process that is enjoyable, thorough, and fair.
we strive to provide an environment that lets you thrive and show off the very best version of yourself, while learning about us at the same time. interviews and onboarding are conducted online, as part of us being a virtual-first company.


we are an equal opportunity employer: dxc is proud to be an equal opportunity employer and we welcome submissions from people from all walks of life. we celebrate our diversity and recognise it is the unique contributions of our people that give us our edge. we stand by the ‘bring your whole-self to work’ philosophy.
it is our inclusive culture that powers our results, and our company grows only if our people grow. accommodation of special needs for qualified candidates may be considered within the framework of the dxc accommodation policy. in addition, dxc technology is committed to working with and providing reasonable accommodation to support qualified individuals with physical and mental disabilities


recruitment fraud is a scheme in which fictitious job opportunities are offered to job seekers typically through online services, such as false websites, or through unsolicited emails claiming to be from the company. these emails may request recipients to provide personal information or to make payments as part of their illegitimate recruiting process. dxc does not make offers of employment via social media networks and dxc never asks for any money or payments from applicants at any point in the recruitment process, nor ask a job seeker to purchase it or other equipment on our behalf.
 more information on employment scams is available here
.",https://www.jobstreet.com.my/companies/dxc-technology-168551246392730/reviews?jobId=74605694,3.6,50
Intern,Prudential Assurance Malaysia Berhad,Kuala Lumpur,undisclosed,30d+ ago,19/5/2024,https://www.jobstreet.com.my/job/74583570?type=standard&ref=search-standalone&origin=cardTitle#sol=67d51f5b86f2252674a34928a390b8e6859e4059,"prudential’s purpose is to be partners for every life and protectors for every future. our purpose encourages everything we do by creating a culture in which diversity is celebrated and inclusion assured, for our people, customers, and partners. we provide a platform for our people to do their best work and make an impact to the business, and we support our people’s career ambitions. we pledge to make prudential a place where you can connect, grow, and succeed.as an information security intern, you will play a crucial role in assisting our organization in maintaining a secure environment. you’ll work closely with experienced team members, participate in security projects, and adhere to technology standards. this internship provides an excellent opportunity to gain practical experience in the field of information security.responsibilities:respond to security-related requests promptly.document processes, procedures, and configurations related to incident handling.coordinate vulnerabilty and pentest remediations 
access management:ensure timely removal or modification of access based on termination listings, emergency requests, and change request formscollaborate with the it team to manage user access rights.
security projects:participate in special security projects as assigned.contribute to the implementation of security controls and enhancements.contribute in secutiy tool migration/upgrade projects
compliance and standards:adhere to established technology standards and follow documented procedures.assist in compliance assessments and audits.assist in pcidss compliance activities
prudential is an equal opportunity employer. we provide equality of opportunity of benefits for all who apply and who perform work for our organisation irrespective of sex, race, age, ethnic origin, educational, social and cultural background, marital status, pregnancy and maternity, religion or belief, disability or part-time / fixed-term work, or any other status protected by applicable law. we encourage the same standards from our recruitment and third-party suppliers taking into account the context of grade, job and location. we also allow for reasonable adjustments to support people with individual physical or mental health requirements.",https://www.jobstreet.com.my/companies/prudential-group-168549673277998/reviews?jobId=74583570,4.1,54
