JobTitle,company,location,salary,date_posted,ExtractDate,job_url,summary,review_url,overall_rating,num_ratings
Ops Support Engineer (DevOps) - Intern,N2N,bangsar south,undisclosed,15d ago,29/5/2024,https://www.jobstreet.com.my/job/75809551?type=standard&ref=search-standalone&origin=cardTitle#sol=15d9c83e5c5838a599c7dab60f1e98d798778969,hiring resourceful internship ops support engineer devops join dynamic team nn connect bhd bangsar south kuala lumpur growing career ops support engineer devops intern awesome opportunity develop useful skill strong communication resourceful right drive job apply position ops support engineer devops intern nn connect bhd today job responsibilitieshelp automate provisioning configuration management infrastructure resource using tool like ansible chef puppet terraform assist setting maintaining cicd pipeline automate software delivery process including code testing building packaging deployment assist implementing monitoring solution track performance application grafana prometheus help manage cloud infrastructure service platform like aws job requirement currently pursuing bachelor degree information technologysoftware engineering equivalent good communication interpersonal skill must proactive take initiative willing take responsibility good english language proficiency summary role requirementsflexible hour availableno experience required roleworking right required roleexpected salary rm rm per month,https://www.jobstreet.com.my/companies/n2n-connect-168558478253068/reviews?jobId=75809551,3.0,21.0
Internship for Computer/IT Students,NEXIBLE SOLUTIONS SDN. BHD.,kuala lumpur,RM 500 – RM 700 per month,15d ago,29/5/2024,https://www.jobstreet.com.my/job/75803397?type=standout&ref=search-standalone&origin=cardTitle#sol=f8238b93718f458289ce9f453c9ba005dc30d39f,gain experience working saas platform project team support team software teamparticipate deployment system including user requirement scoping design testing implementationassist application feature testing web mobile app io androidto coordinatesupport system testing business key user compiledocument test resultsbuilding onboardingtraining material new enhancementsguide user boarding assist challengesplease indicate internship period short description,,,
Internship for Computer / IT Students,FootfallCam,kuala lumpur,"RM 800 – RM 1,200 per month",15d ago,29/5/2024,https://www.jobstreet.com.my/job/75788423?type=standout&ref=search-standalone&origin=cardTitle#sol=286611f20fdbf3628b0d03c7694c464a97468520,current student looking exciting internship want work dynamic innovative team challenging project make real impact internship program seeking passionate talented individual join team work realworld project gaining valuable handson experience member team youll chance collaborate experienced professional take skill next level youre ready challenge apply join team arefootfallcam cuttingedge technology company changing way retailer understand engage customer advanced video analytics solution use artificial intelligence machine learning analyse customer foot traffic realtime providing retailer valuable insight shopping behaviour trend footfallcam retailer optimise store layout improve customer experience increase sale retail industry evolves footfallcam forefront innovation constantly developing new solution help retailer succeed team experienced professional passionate helping client succeed rapidly changing market role general job scopepeople counter accuracy tuning quality controldata annotation ai model trainingassist administrative tasksplan optimise sensorsdevices placement large scale project deploymentpreferably start internship august onwards rolespecific job scopeapprentice artificial intelligence machine learning computer vision big datalearning opportunitiesdata gathering preprocessingmodel training evaluationdata visualisation statistical analysisobject detection recognition preferred skill setmachine learning library framework scikitlearn opencv tensorflow pytorchdata visualisation tool matplotlib seabornstatistical analysis technique hypothesis testing regression analysis apprentice front end development web app mobile applearning opportunitiesbuild responsive site using semantic html efficient cs selectorsoptimise web page performance using technique like minification lazy loadinglearn design skill create visually appealing userfriendly interface preferred skill setjavascript framework library jquery react vuejsexperience browser developer console troubleshoot issuesunderstanding uiux design principle design mockups usercentric design apprentice back end developmentlearning opportunitiesdatabase management includes sql query optimization data migrationsrestful apis development external apis integrationunderstanding containerisation tool cicd pipeline preferred skill setfamiliar least one backend programming language java python nodejsbasic understanding relational database nosql databasegood technical writing skill work documentation apprentice production flowlearning opportunitiesutilise diverse range hand power tool electric meter material handling equipment carry assigned tasksacquire skill necessary identify faulty operation defective materialscommunicate identified issue unusual occurrence effectively appropriate supervisory personnel preferred skill sethigh adaptability fastchanging workflowsgood analytical mindset identifying issue troubleshootinghold minimum diploma engineering equivalent experience manufacturing environmentbasic knowledge c programming sql database join usgain valuable industry exposure realworld settinglearn professional various technological fieldsenhance technical knowledge latest technology software toolsopportunity fulltime employment upon internship completionbuild professional network valuable future job seeking impact makebring fresh idea team stimulate improvement company productsstreamline optimise internal workflow automating repetitive task reduce manual effortdevelop maintain integration point apis company softwareimprove reliability robustness company softwareproducts developing executing test case identifying reporting issue whats morestrategic location heart downtown bandar sungai long easy access restaurant clinic grocery amenitiesmoderate cost living affordable housing option within walking distance short commute available rentconvenient shuttle bus service nearby public transit station easy get work,https://www.jobstreet.com.my/companies/footfallcam-168554412276425/reviews?jobId=75788423,3.9,94.0
IT Intern,MOL ACCESSPORTAL SDN. BHD.,shah alamsubang,undisclosed,15d ago,29/5/2024,https://www.jobstreet.com.my/job/75787132?type=standard&ref=search-standalone&origin=cardTitle#sol=683458f9f7985e86b4f10c95c7375534cf2d4e60,joining razer place global mission revolutionize way world game razer place great work offering opportunity make impact globally working across global team located across continent razer also great place work providing unique gamercentric lifeatrazer experience put accelerated growth personally professionally job responsibility highly motivated individual passionate latest technology looking gain handson experience support cyber security encourage apply internship opportunity work variety project initiative across region learn top talented experienced professional field assist setting configuring hardware software system participating coding deployment exercise provide technical support endusers including troubleshooting hardware software issue perform routine maintenance computer printer equipment perform security scanning server firewall webmobile application api container rd party endpoint prepare tech risk compliance audit supporting document assist network administration task setting user account maintaining network security participate project initiative software rollouts system upgrade document technical procedure process keep uptodate latest technology tool industry adhoc task assigned team lead prerequisite pursuing bachelor master degree computer science information technology related field strong interest technology support basic understanding computer hardware software system strong analytical problemsolving skill excellent communication interpersonal skill ability collaborate crossfunctional team ability learn quickly adapt new technology strong attention detail commitment delivering highquality work game,,,
IT Intern,foodpanda Malaysia Sdn Bhd (Corporate Office),bangsar,undisclosed,15d ago,29/5/2024,https://www.jobstreet.com.my/job/75784411?type=standard&ref=search-standalone&origin=cardTitle#sol=78f375a06297559022986d6051a11b2a8b840943,opportunity start customer end customer communicate user via chatffemails determine nature problem encounter ensure internal user issue resolved includes onsite remote support needed ensure onboarding offboarding activity process properly tracked followed investigating diagnosing solving computer software hardware setting account staff ensuring platform used company installed maintain outperform kpisslas csat score understands importance work prioritizes work according business criticality endtoend technical capability administration planning installation window mac system installing configuring computer hardware software printer door access cctv basic network troubleshooting take part scheduled maintenanceprojects office build network miscellaneous physical extension foodpanda business support audiovisual requirement site including meeting room event adhoc setup scale governance managing company asset ensuring asset tracked throughout lifecycle keeping proper record ticket resolution ticketing tool based ticket received user providing solution user understands process procedure add value decisionmaking consulting senior necessary participate involved execution step address security incident necessary continuous improvement actively help implement change within domain need successful degree computer science information technology similar field strong technical skill passion acquiring new technology basic understanding computer software hardware operating system window macos knowledge principle procedure troubleshooting method networking outstanding ability solve problem pay attention detail interpersonal communication ability work capacity operate individually together group setting loved everyday food grocery destination thats mission foodpanda foodpanda small f largest food grocery delivery platform asia outside china operating city across market continue expand grow core food delivery business well new vertical like grocery delivery strong tech infrastructure core restaurantspartners cloud kitchen cloud grocery store foodpanda one tap away getting everything need hand quickly conveniently looking enthusiastic problem solver join u scaling platform digitalise business asia uplift rider livelihood build hyperconvenient platform customer love working technology create solution afraid roll sleeve get thing done find tribe foodpanda diverse highperforming team comprises people nationality welcome experience background perspective,https://www.jobstreet.com.my/companies/foodpanda-168554414130817/reviews?jobId=75784411,3.8,102.0
Computer Technician Intern,BYTESONIX TECHNOLOGY SDN. BHD.,selangor,RM 600 – RM 800 per month,18d ago,29/5/2024,https://www.jobstreet.com.my/job/75767394?type=standard&ref=search-standalone&origin=cardTitle#sol=58709c6b7eba7a565d331eda3fc60ad583282701,computer technician responsibilitiessetting installing new hardware software systemsdiagnosing troubleshooting computer issuesmaintaining hardware software conducting regular maintenance updatesupgrading firmware software outdated hardware systemsmonitoring maintaining security system installing updatespacking computer saleassist walkin customerslocationbangiwork hoursday work weekday work week intern select shiftampmpmpmampmpmpminterns select shiftallowance rate based work hour,,,
Database Engineer Intern,MOL ACCESSPORTAL SDN. BHD.,bangsar,undisclosed,18d ago,29/5/2024,https://www.jobstreet.com.my/job/75772884?type=standard&ref=search-standalone&origin=cardTitle#sol=5ce24eb62791f23347da870dc645d0d52a94e349,joining razer place global mission revolutionize way world game razer place great work offering opportunity make impact globally working across global team located across continent razer also great place work providing unique gamercentric lifeatrazer experience put accelerated growth personally professionally job responsibility seeking resultsoriented database engineer intern help optimize performance organization database seeking resultsoriented database engineer intern help optimize performance organization database ensure success database engineer intern exhibit knowledge best practice database management maintaining enhancing performance existing database program assisting database development team designing new database program meet organization data storage need monitoring database related system ensure optimized performance reviewing database script database design audit log report well system information performing debugging procedure database script well resolving conflict mentoring database administrator providing technical support adhering best practice securely storing backing archiving data documenting process related database design configuration performance keeping abreast development best practice database engineering prerequisite bachelor degreedeploma information system information technology computer science similar applicable licensing certification registration indepth knowledge structured query language sql extensive experience database technology architecture sound knowledge best practice database management data security strong organizational skill attention detail exceptional problemsolving critical thinking skill excellent collaboration communication skill game,,,
Digital Marketing Internship,MCSB Group,penang,undisclosed,18d ago,29/5/2024,https://www.jobstreet.com.my/job/75764539?type=standard&ref=search-standalone&origin=cardTitle#sol=7972d17ad64d72f922723bf00c641a31b54fe4ab,scopedriving daily social medium telemarketing activitiesparticipate market strategy planning session providing creative idea insight boost company revenueperform market analysis research competition latest industry trendsupdate housekeep client databaseplan create weekly marketing content advertising promotional activity fb ig linkedin etcmonitoring performance analyzing data reporting campaign effectivenessexplore seo activity viability part marketing activitiesexploring automation eg crm software sale opsrevamp project proposal templaterequirementsminimum diploma marketing equivalent fieldrequired skill ccmssql serveraspnet visual basic crystal report net mvc adobepreferred skill computer software video marketing social mediajob type internshipcontract length monthspay rm per monthschedulemonday fridayeducationdiplomaadvanced diploma preferredlanguageenglish malay preferredsummary role requirementslooking candidate available workmonday morningtuesday morningwednesday morningthursday morningfriday morningno experience required roleworking right required roleexpected salary rm per month,https://www.jobstreet.com.my/companies/mcsb-systems-168551423433339/reviews?jobId=75764539,3.7,14.0
"Internship for IT Students (Java, Mobile Developer) - RM2,000 for Top Students",iFAST Capital Sdn Bhd,kuala lumpur,undisclosed,18d ago,29/5/2024,https://www.jobstreet.com.my/job/75743769?type=standout&ref=search-standalone&origin=cardTitle#sol=cb551fe6b2e70462a55af8f798f27c989bd7969d,join team always buzzing new idea incentive innovate consisting specialist diverse skill website mobile development team member also bring crossmarket experience worked project locally also across market group hungry new experience cannot wait think next best way achieve mission statement help investor around world invest globally profitably place youresponsibilitiestranslate user requirement mobile app system designopportunity involved full stack web developmentrequirementscandidate must posse currently pursuing bachelor degree computer scienceinformation technology equivalentpriority given good understanding java javascript html cssavailable duration monthsapplicants interested role invited apply comprehensive resume full detail via apply button qualification skill working experience expected salary kindly attach copy academic transcript certification together resume application treated strict confidence regret shortlisted applicant notifiednote job responsibility requirement representative intended detailed list tasksabilities may required incumbent relative specific assignment,https://www.jobstreet.com.my/companies/ifast-capital-168552969685227/reviews?jobId=75743769,4.0,21.0
Summer Internship - FDC Engineer,MICRON MEMORY MALAYSIA SDN. BHD.,batu kawan,undisclosed,18d ago,29/5/2024,https://www.jobstreet.com.my/job/75767542?type=standard&ref=search-standalone&origin=cardTitle#sol=162487aab2377eae106a5629f4e277e7c232abf4,vision transform world us information enrich life micron technology world leader innovating memory storage solution accelerate transformation information intelligence inspiring world learn communicate advance faster ever jr summer internship fdc engineer project titlesetup fault detection control fdc machine description setup ytap enable connection setup limit recipe machine scope engage different team engineering qa enable setup fdc running test run uat setup data collection analysis setup supporting team team engineering team qa team deliverable able setup fdc machine result machine able enter fdc chart tool interdiction functional machine stretch goal involve troubleshooting machine including debugging error micron technology inc industry leader innovative memory storage solution transforming world us information enrich life relentless focus customer technology leadership manufacturing operational excellence micron delivers rich portfolio highperformance dram nand memory storage product micron crucial brand every day innovation people create fuel data economy enabling advance artificial intelligence g application unleash opportunity data center intelligent edge across client mobile user experience learn please visit microncomcareers qualified applicant receive consideration employment without regard race color religion sex sexual orientation gender identity national origin veteran disability status request assistance application process andor reasonable accommodation please contact hrsupportmymicroncom micron prohibits use child labor complies applicable law rule regulation international industry labor standard micron charge candidate recruitment fee unlawfully collect payment candidate consideration employment micron,https://www.jobstreet.com.my/companies/micron-semiconductors-168551078128068/reviews?jobId=75767542,3.8,33.0
Internship Trainee (IT/Developer),NSN Technology Sdn Bhd,jalan ipoh,RM 600 per month,19d ago,29/5/2024,https://www.jobstreet.com.my/job/75725964?type=standard&ref=search-standalone&origin=cardTitle#sol=c4c8c35d4b8011e1e768eb71d74433deacfbea18,usa technology company mission build innovative tech product solve problem supply chain industry founded incorporated business focus tech product development software hardware firmware work requirement posse currently pursuing diploma bachelor degree information technology equivalent posse good interpersonal communication skill available internship duration month excellent oral written communication skill b duty responsibility support team member daytoday task help manage maintain documentation administrative task perform duty responsibility assigned superior depending skillset contribute code existing software aspnetangular c benefit working day monday friday working hour pm minute walk sentul west mrt station laptop provided freeflowing snack refreshing drink additional information would rate english language skill writing following programming language familiar diplomadegree cgpa range,,,
Internship - Information & Digital Services,Technip Energies,johor bahru,undisclosed,20d ago,29/5/2024,https://www.jobstreet.com.my/job/75728579?type=standard&ref=search-standalone&origin=cardTitle#sol=968254bb3c955012975b9b7ff8bdf30247c13216,prepares basic report presentation correspondence gathering summarizing data directed regularly contact vendor supplier employee outside immediate work assembles relevant data compiles information directed organizes maintains file correspondence record following pending matter schedule appointment coordinate arrangement meeting conference organizes expedites flow work supervisor office initiate followup action,,,
"Internship For Electrical Student - ELV, BMS, FTTH, etc",AVANT GARDE SOLUTIONS (M) SDN. BHD.,cheras,"RM 990 – RM 1,000 per month",20d ago,29/5/2024,https://www.jobstreet.com.my/job/75693210?type=standard&ref=search-standalone&origin=cardTitle#sol=3d9126191c6e6d3e64c78449b0125787c1f240db,taskresponsibilitylearn diagnose troubleshoot technical issue equipment system processesassist analyzing data identify trend pattern potential improvementsassist documenting procedure protocol observation includes keeping record maintenance activity equipment performance change madesupport technician installing new equipment system upgrade learn proper installation procedure safety protocolslearn adhere safety protocol procedure assist maintaining safe clean work environmentwork collaboratively team member department communicate effectively supervisor colleaguestake initiative learn new skill technology process relevant role seek guidance technician participate training opportunitiesfollow company policy procedure industry regulation maintain confidentiality sensitive information adhere ethical standardsassist various project related technical research development implementation may involve conducting experiment gathering data assisting project documentationbenefitallowance rm per monthcan claim related work,,,
Internship Property Management,Invenio Potential,johor bahru,"RM 700 – RM 1,000 per month",20d ago,29/5/2024,https://www.jobstreet.com.my/job/75686312?type=standard&ref=search-standalone&origin=cardTitle#sol=24f9fffc851cd57be08b9794a43beea94005250a,job responsibility assist managing portfolio property using property management software assist overseeing day day property operational mattersensure proper upkeep engineering building system plan manage preventive maintenance schedulemanage monitor service provider adhoc contractor onsite jobsensure property compliance local regulation liaise authority regard regulatory property mattersattend resident complaint timely manner resolve problemscomplaintsprepare attend monthly committee meetingwork closely procurement team defect team finance team ensure building well maintainassist adhoc task assigned superiormanager time timerequirements degree property managementestate management related subjectinternship period monthsproficient spoken written english bahasa malaysiaposses transport able travelselfmotivated ability work independently team environment,https://www.jobstreet.com.my/companies/invenio-potential-168551933385807/reviews?jobId=75686312,4.0,3.0
Internship IT,Invenio Potential,johor bahru,"RM 700 – RM 1,000 per month",20d ago,29/5/2024,https://www.jobstreet.com.my/job/75686269?type=standard&ref=search-standalone&origin=cardTitle#sol=925b1af7edbef0cf530544b3e32d1dfa58504c77,responsibility assist providing technical support endusers troubleshoot resolve hardware software issue assist itrelated inquiriesmanage maintain organization network infrastructure including router switch firewall wireless access pointsoversee setup configuration maintenance server system ensuring run efficiently securelyassist managing database ensuring data integrity backup recovery procedure placeassist procuring maintaining hardware software itrelated equipment ensuring meet organization requirementsmaintain uptodate documentation process procedure system configurationsinteract vendor support maintenance software licensingassist planning implementing project ensuring completed within budget timelinecontribute development implementation policy proceduresstay informed latest trend technology make recommendation potential implementation within organizationensure data backup performed regularly develop test disaster recovery plansmonitor system performance network connectivity security log identify resolve issue proactivelywork crossfunctional team including staff management endusers address itrelated challenge requirementsassist managing budget expenditure effectively requirementsa bachelor degree computer science information technology related field often preferredproficiency various technology including operating system window macos linux networking hardware troubleshooting software applicationsgood written verbal communication skill essential interact endusers convey technical information effectivelyunderstanding security principle best practice crucial protect organization data system,https://www.jobstreet.com.my/companies/invenio-potential-168551933385807/reviews?jobId=75686269,4.0,3.0
