JobTitle,company,location,salary,date_posted,ExtractDate,job_url,summary,review_url,overall_rating,num_ratings
Internship for Engineering / Computer Science Students,ViTrox Corporation Bhd / ViE Technologies Sdn Bhd,penang,"RM 1,100 – RM 1,300 per month",28d ago,29/5/2024,https://www.jobstreet.com.my/job/75512232?type=standout&ref=search-standalone&origin=cardTitle#sol=3be21cb9aacc534e47ccdba89337eb88b1ad97d3,vitrox penangbased design manufacturing company put today imperative digital transformation compassionate innovation heart brand turn best machine vision technology trusted solution semiconductor manufacturerswere looking individual eager embark challenging rewarding internship journey u throughout internship youll opportunity explore various area including limited rd softwareassist submodule developmentassist root cause analysis using debugging tool statistical tool etchandson learning programming language c c python java net qt etc rd mechanicalassist hardware designinvolve root cause analysis troubleshootingexposure product design development rd electrical electronicsexposure control design npi product firmware design developmentassist electrical standard part selection wiring program technical design documentation productsinvolve plc c programming debugging circuit design prototype testing software testdesign carry test casesassist updating test recordcreate maintain user manual application note technical supportassist system setup maintenance troubleshooting system buyoffprovide customer service supportfollow customer service status information technology ittroubleshoot computer hardwareassist small application project submodule developmentassist daily operation visit httpsvitroxcomcareersjobsinternshipprogrammephp requirementspossess currently pursuing phd master degree advanced diploma diploma engineering related computer science information technology equivalentgood problemsolving skill selfmotivatedwillingness go extra mile today talent tomorrow success inspired challenged great,,,
INTERNSHIP,Cosco Shipping Lines (Malaysia) Sdn Bhd,petaling jaya,"MYR 1,000 - 1,500",28d ago,29/5/2024,https://www.jobstreet.com.my/job/75491612?type=standard&ref=search-standalone&origin=cardTitle#sol=d747db1d6496ec051673bea033a19b5208607c4f,job highlight good learning process experience job descriptionhey student looking internship placementwere looking intern join big familyif interested please drop resume state theposition title would like apply emailminimumrequirement midst completing diploma study latest cgpa midst completing degree study latest cgpa oflocation bandar sunway selangorothers minimum tenure month basic programming skill required student trained based onthejobtraining day working company,https://www.jobstreet.com.my/companies/cosco-shipping-lines-168557400320594/reviews?jobId=75491612,3.8,5.0
INTERNSHIP FOR IT STUDENT,Hup Fatt Brothers Engineering (M) Sdn Bhd,ulu tiram,RM 650 – RM 950 per month,28d ago,29/5/2024,https://www.jobstreet.com.my/job/75488015?type=standout&ref=search-standalone&origin=cardTitle#sol=d4de20a932b2509c4c82a749f1d9814dae37d1f3,job scope responsibilitiesexecute regular maintenance procedure ensure effective operation enhance overall functionalityprovide support production site system network ensure effectiveness system networkimplement security measure safeguard organizational data fortify network infrastructureprovide technical support endusers resolving wide spectrum technical challengesmaintain systematic filing record ensure traceability record key skill qualificationcandidate must posse least diploma bachelor degree computer science equivalentrequired language bahasa malaysia englishknowledge computer system software application hardware networking server communication,,,
Business Analysis Intern,Avanade Malaysia Sdn Bhd,kuala lumpur,undisclosed,29d ago,29/5/2024,https://www.jobstreet.com.my/job/75610297?type=standard&ref=search-standalone&origin=cardTitle#sol=39e0ed3357f6ecdca3873bf66f499afa634cd085,shape future code conquer cloud tech unleash innovation avanades southeast asia internship program created one purpose revolutionize way design deliver engaging connected experience client customer combination creative technology expertise intern participate creating new radical exciting solution client biggest challenge youre interested let u know wed crazy bring onboard together matter,https://www.jobstreet.com.my/companies/avanade-168549743361697/reviews?jobId=75610297,4.0,8.0
Internship Trainee (IT),Kawan Food Manufacturing Sdn Bhd,pulau indah,RM 600 per month,29d ago,29/5/2024,https://www.jobstreet.com.my/job/75466588?type=standout&ref=search-standalone&origin=cardTitle#sol=7720980afa4af0ac31ba044f338098ed9309e2b0,duty responsibilitiesto support team member daytoday tasksto help manage maintain documentation administrative tasksperform duty responsibility assigned superior work requirementspossess currently pursuing diploma bachelor degree information technology equivalentmust willing travel pulau indahavailable internship duration month,https://www.jobstreet.com.my/companies/kawan-food-berhad-168555055346050/reviews?jobId=75466588,3.1,23.0
"Jobs for Computer Science, IT and Software Engineering Graduates",Keysight Technologies Malaysia Sdn. Bhd.,bayan lepas,undisclosed,29d ago,29/5/2024,https://www.jobstreet.com.my/job/75463124?type=standout&ref=search-standalone&origin=cardTitle#sol=2091cc3a0bda7619a96e72ecbdd6e9fb22372c1c,join cuttingedge team driving force behind next technological revolution embrace challenge creating groundbreaking innovation industryleading solution shape futureunleash passion technology innovation vision transform aspiration reality find design test software keysightwe seek graduate passion relentless drive innovation vision look future inspiration make vision reality various exciting technical opening recent graduate software developer programmer web developer full stack engineer uxui designer devops developer software engineer test engineer automation engineer network application engineer etc rd manufacturing departmentsas graduate first learn business product solution project platform programming language etcbased assignment could responsible designing coding supporting testing debugging software related applicationsour experienced mentor guide every step way providing invaluable insight support additionally company various platform empower acquire necessary skill technology excel fieldbe part team dare push boundary redefine possibility shape future technologyjob qualificationcandidate must posse least bachelor degree computer scienceinformation technology software engineering equivalentno work experience requiredto secure job looking candidate attention detail good interpersonal skill growth mindset curiosity problemsolving,https://www.jobstreet.com.my/companies/keysight-technologies-168551179724998/reviews?jobId=75463124,4.6,889.0
"Intern, Project",Teleport Commerce Malaysia Sdn Bhd,sepang,undisclosed,30d+ ago,29/5/2024,https://www.jobstreet.com.my/job/75435695?type=standard&ref=search-standalone&origin=cardTitle#sol=c5026734de7a997038f6f82ddd6f5fe57843e0be,teleport mission innovate traditional cargo delivery industry enable everyone single merchant largest company move good ecommerce anywhere southeast asia beyond simply work like magic therefore critical ensure content relevant potential customer ranging major ecommerce player individual want parcel delivered looking someone enthusiastic resilient intern cargo strategy project team based office redq sepang expected performing role fulltime basis expected performing role fulltime basis role report assistant manager strategy project fit perfectly enjoy fastpaced working environment passionate colleague day life startup expect day pretty varied multitasking normal sometimes skill natural talent leveraged support business priority said bulk working hour involve document map teleport overall revenue recognition user journey process collaborating multiple stakeholder across revenue management commercial finance identify key point current process failure devise recommend potential remedy mitigate potential revenue leakage maintain uptodate repository revenuerelated document including limited airwaybill scanned copy cargo manifest ensure individual gross chargeable weight freight rate individual airway bill captured accurately accordance including limited weight break agentshipper commodity code rate validity ensure monthly cargo sale report produced general sale agent consistent actual revenue record communicate resolve revenue discrepancy variance revenue management finance requirement skill minimumrequirement skill musthave role excellent problem solving skill focus delivering implementable solution result willingness work outside comfort zone try new thing proficient powerpoint word excel highly developed oral written communication skill especially english qualification experience final year student pursuing degree finance accounting statistic economics willing commit minimum month working experience would gain extra pointer,https://www.jobstreet.com.my/companies/teleport-168558469810277/reviews?jobId=75435695,3.0,3.0
Internship - Information Technology,SANICHEM RESOURCES SDN. BHD.,titi,undisclosed,30d+ ago,29/5/2024,https://www.jobstreet.com.my/job/75381387?type=standard&ref=search-standalone&origin=cardTitle#sol=01587607089909333d466d53810d6eb9cb88bd5b,job summary seeking highly motivated enthusiastic intern assist learn top management successful candidate work closely lab manager provide support laboratory information management system lims creation implementation skill proficient system application excellent problemsolving skill strong communication skill detailoriented organized ability work independently part team responsibility provide technical support software implementation perform data entry task accurately various database spreadsheet assist documentation process future reference qualification currently pursuing degree information technologyengineeringscience related field knowledge programming language javacpython added advantage available fulltime internship position good academic standing minimum cgpa equivalent candidate must strong analytical thinking skill note applicant meet qualification considered,,,
Internship for Data Analysis Students,Boardroom Corporate Services Sdn Bhd,kuala lumpur city centre,undisclosed,30d+ ago,29/5/2024,https://www.jobstreet.com.my/job/75295707?type=standard&ref=search-standalone&origin=cardTitle#sol=68ddf1b15bb902f7937eaf5ece44e8ac148a0319,problemsolving analytical understanding statistic data technical skill competency using data analytics software includes excel salesforce others continuously strive way improve operational efficiency develop report maintain spreadsheetsdata metric monitor track evaluate performance support provide technical assistance inquiry issue tasksproject assigned superior management,https://www.jobstreet.com.my/companies/boardroom-168550537573523/reviews?jobId=75295707,3.0,8.0
Graduate Intern Technical,Intel Technology Sdn. Bhd.,penang,undisclosed,30d+ ago,29/5/2024,https://www.jobstreet.com.my/job/75683529?type=standard&ref=search-standalone&origin=cardTitle#sol=f18245cce4dda474c80ecfe5c394b59f05a0dee9,job detailsjob description design develops test debugs software application used end user integrated application isvs learn support development effort whichmay span full application stack including frontend backend application development us modern software development methodology programming language follows secure coding practice software legal compliance guideline analyzes user story writes functional test code automates build deployment performs unit integration end end testing application completes sdl task assistance product security engineer provides input technical writer complete product documentation procedure installation maintenance may also interact end user define system requirement andor necessary modificationsqualificationstechnical individual passionate try latest development method explore bringing innovation current application candidate passionate react net sql github safeagile development requirement gathering analysis end customersjob typestudent internshiftshift malaysiaprimary location malaysia penangadditional locationsbusiness groupintels information technology group design deploys support information technology architecture hardwaresoftware application intel includes lan wan telephony data center client pc backup restore enterprise application also responsible ecommerce development data hosting delivery web content servicesposting statementall qualified applicant receive consideration employment without regard race color religion religious creed sex national origin ancestry age physical mental disability medical condition genetic information military veteran status marital status pregnancy gender gender expression gender identity sexual orientation characteristic protected local law regulation ordinanceposition trustnawork model rolethis role eligible hybrid work model allows employee split time working onsite assigned intel site offsite certain circumstance work model may change accommodate business need,https://www.jobstreet.com.my/companies/intel-168557465784246/reviews?jobId=75683529,4.5,301.0
Internship - Manufacturing Engineering,Western Digital,bayan lepas,undisclosed,30d+ ago,29/5/2024,https://www.jobstreet.com.my/job/75221015?type=standard&ref=search-standalone&origin=cardTitle#sol=7c71452f17b25a871551fa14bd0f12d8399ca2ab,company description western digital vision power global innovation push boundary technology make thought impossible possible core western digital company problem solver people achieve extraordinary thing given right technology decade weve technology helped people put man moon key partner largest highest growth organization world energizing competitive gaming platform enabling system make city safer car smarter connected powering data center behind many world biggest company public cloud western digital fueling brighter smarter future bingewatch show use social medium shop online lately youll find western digital supporting storage infrastructure behind many platform flash memory card capture preserve precious moment thats u offer expansive portfolio technology storage device platform business consumer alike datacentric solution comprised western digital gtechnology sandisk wd brand today exceptional challenge require unique skill western digital together next big thing data job description develop new engineering solution equipment improvement medium tester procedure methodology documentation review new project provide assessment feedback schematic review hardware modification suggestion improvement implement hardware improvement medium tester qualification pursuing bachelor degree majoring electrical electronics engineering additional information western digital thrives power potential diversity global company believe effective way embrace diversity customer community mirror within believe fusion various perspective result best outcome employee company customer world around u committed inclusive environment every individual thrive sense belonging respect contribution western digital committed offering opportunity applicant disability ensuring candidate successfully navigate career website hiring process please contact u jobsaccommodationswdccom advise u accommodation request email please include description specific accommodation requesting well job title requisition number position applying notice candidate western digital received report scam payment requested western digitals behalf condition receiving offer employment please aware western digital subsidiary never request payment condition applying position receiving offer employment encounter request please report immediately compliancewdccom,https://www.jobstreet.com.my/companies/western-digital-168490972882933/reviews?jobId=75221015,4.3,378.0
Internship - Sourcing & Procurement,Technip Energies,kuala lumpur,undisclosed,30d+ ago,29/5/2024,https://www.jobstreet.com.my/job/75160702?type=standard&ref=search-standalone&origin=cardTitle#sol=a8f5ff576fa6f502f83691fe770d110b187bbece,prepares different report related work processed drawing data variety identified source within outside department prepares special report analysis within prescribed guideline instruction regularly contact vendor supplier employee outside immediate work assembles relevant data compiles information directed organizes maintains file correspondence record following pending matter receives screen telephone call letter andor visitor answering routine question providing information schedule appointment coordinate arrangement meeting conference travel related issue organizes expedites flow work supervisor office initiate followup action,,,
Intern - IT Application Support,Eastspring Investments Berhad,kuala lumpur city centre,undisclosed,30d+ ago,29/5/2024,https://www.jobstreet.com.my/job/75090898?type=standard&ref=search-standalone&origin=cardTitle#sol=5567780c53db1037520594810f79505146ebe5fa,eastspring global asset manager asia core create culture diversity celebrated inclusion assured colleague customer partner provide platform people best work make impact business exchange support people career ambition pledge make eastspring place connect grow succeed job summary provide support diagnosing application issue troubleshooting activity participate development software application business intelligence development activity handle related documentation document process reference manual training guidance including application inventory management assist gathering user requirement developing appropriate report would learn attachment appreciate environment asset investment management firm understand role application support within department understand support process take project management analyst intern highly selfmotivated effective team player pay attention detail ability work independently general supervision good written spoken skill english bahasa malaysia eastspring equal opportunity employer provide equality opportunity benefit apply perform work organisation irrespective sex race age ethnic origin educational social cultural background marital status pregnancy maternity religion belief disability parttime fixedterm work status protected applicable law encourage standard recruitment thirdparty supplier taking account context grade job location also allow reasonable adjustment support people special requirement,https://www.jobstreet.com.my/companies/eastspring-investments-168557542623447/reviews?jobId=75090898,4.2,5.0
Internship - IT Operations & Infrastructure,Hilti (Malaysia) Sdn Bhd,petaling,undisclosed,30d+ ago,29/5/2024,https://www.jobstreet.com.my/job/74969070?type=standard&ref=search-standalone&origin=cardTitle#sol=24cda768e16e7fecce39f7943de977615043de62,whats role join u intern team work exciting project ranging operation infrastructure member international multidisciplinary team gain experience global project solution management improve practical expertise solve reallife challenge international enterprise hilti hilti innovation improving productivity safety sustainability global construction industry beyond strong customer relationship creating solution build better future pride sense belonging across location carrying right life home people exploring possibility leveraging potential owning personal development growing lasting career global within hilti truly global team main hub buchs switzerland kuala lumpur malaysia planotulsa usa location highly competent team work closely together hiltis global team known focus sustainable value creation translating latest innovation value creating solution service role involve identify analyze business requirement creative innovative solution based customer need strategic requirement responsible perform administration operation sap system associated component rd party tool automic well system salesforcecom role involves leading incident deescalation via war room approach hiltis whole global community required initiate facilitate drive war room critical incident resolution collaboration multiple team internal external andor business partner also ensure stakeholder well informed throughout process excellent mix people believe make vibrant innovative productive team offer show u youre made well offer opportunity move around business work abroad experience different job function tackle different market great way find right match ambition achieve exciting career youre thorough people review process unlike know business pair talent opportunity developing people current role challenging work new way new place find right fit team personally professionally get best value employee increase job satisfaction additionally offer wide range benefit need currently enrolled bachelor master study computer science information technology engineering computertelecommunication science technology related field strategic approach good problemsolving skill paired proactiveness handson mentality strong communication skill interpersonal skill fluent written spoken english eager learn challenge apply become valuable member highly professional international team expert meet challenge global multinational company using latest technology freedom act responsible area career prospect dynamic environment excellent opportunity develop higher level wider range knowledge team kuala lumpur fully recognized respected competence center covering relevant area top position filled internally clearly defined career development track every individual employee excellent team duly rewarded performance click apply button asked upload cv answer couple short questionsthe whole process take around second like see youll invited telephone interview dont suitable role moment keep talent pool future recruitment process might take bit longer well sure stay touch joinhiltiasiaitservices looking forward hearing,https://www.jobstreet.com.my/companies/hilti-168553012630402/reviews?jobId=74969070,4.3,116.0
Internship - DevOps Engineer,Hilti (Malaysia) Sdn Bhd,petaling,undisclosed,30d+ ago,29/5/2024,https://www.jobstreet.com.my/job/74969080?type=standard&ref=search-standalone&origin=cardTitle#sol=e40dc8ee769ef3f49c76e07359f6913c7fd835a7,whats role join u intern team work exciting project devops engineer member international multidisciplinary team gain experience global project solution management improve practical expertise solve reallife challenge international enterprise start date internship flexible student availability duration least month hilti hilti innovation improving productivity safety sustainability global construction industry beyond strong customer relationship creating solution build better future pride sense belonging across location carrying right life home people exploring possibility leveraging potential owning personal development growing lasting career global within hilti truly global team main hub buchs switzerland kuala lumpur malaysia planotulsa usa location highly competent team work closely together hiltis global team known focus sustainable value creation translating latest innovation value creating solution service role involve devops engineer goto technical expert wide range understanding development operation aspect hilti cloud product system assume responsibility partner business stakeholder understand requirement translate technical design together solution architect work closely product development team cloud platform engineering team continuously improve overall cicd toolchain drive technical lifecycle activity product development team ensure evergreen system continuously explore improve existing solution based proven futureready technology provide nd rd level support business stakeholder excellent mix people believe make vibrant innovative productive team offer show u youre made well offer opportunity move around business work abroad experience different job function tackle different market great way find right match ambition achieve exciting career youre thorough people review process unlike know business pair talent opportunity developing people current role challenging work new way new place find right fit team personally professionally get best value employee increase job satisfaction additionally offer wide range benefit need currently enrolled bachelor master study information technology software engineering data science computer engineering related field strategic approach good problemsolving skill paired proactiveness handson mentality strong communication skill interpersonal skill fluent written spoken english eager learn challenge apply become valuable member highly professional international team expert meet challenge global multinational company using latest technology freedom act responsible area career prospect dynamic environment excellent opportunity develop higher level wider range knowledge team kuala lumpur fully recognized respected competence center covering relevant area top position filled internally clearly defined career development track every individual employee excellent team duly rewarded performance click apply button asked upload cv answer couple short questionsthe whole process take around second like see youll invited telephone interview dont suitable role moment keep talent pool future recruitment process might take bit longer well sure stay touch joinhiltiasiaitservices looking forward hearing,https://www.jobstreet.com.my/companies/hilti-168553012630402/reviews?jobId=74969080,4.3,116.0
