JobTitle,company,location,salary,date_posted,ExtractDate,job_url,summary,review_url,overall_rating,num_ratings
Internship - IT System & Support Engineer,Softinn Solutions Sdn. Bhd.,ayer keroh,undisclosed,5d ago,29/5/2024,https://www.jobstreet.com.my/job/76089003?type=standard&ref=search-standalone&origin=cardTitle#sol=8b9d15aa081528e123353e8588d67086dd01abbf,softinn hotel technology companyour mission make hotelier work easier intend achieve nextgeneration hotel management software digital solution hotel kiosk here oneminute video productswere selling forwardlooking hotelier south east asia customer malaysia philippine indonesia thailandsoftinn build business software kiosk ecommerce solution hotel hotelier use product run business operation average user interact product per minuteour internship system support engineer meant good knowledge mathematical analysis computer science engineering meant would like pursue system support engineer careerthis position suitable student studying computer science job responsibilityprovide technical assistance client product service offered softinnprovide guidance client product service offered softinntroubleshoot error related softinns system work product team customer solving bugsanswer reply client technicalrelated issue via email whatsapp live chat phone callassist system setup configuration new potential clientassist uat useracceptance testing new product releasejob requirementscurrently pursuing diploma bachelor information technology related technical fieldgood understanding cloudbased software product strong logical thinkingreasonable foundation algorithm analytical skillsproficient english written spokenability communicate clearly team membersthe minimum internship duration month preferably month mandatory bonus ifexcellent implementation skillsyou knowledge cloud base web applicationyou knowledge kiosk engineering report work optionsmelaka join youwant pursue system support engineer careera strong believer better product help improve efficiency bring smile stakeholdersnot afraid asking questionsnot afraid find solution seek help othersnot afraid face challengelooking casual working culture join younot comfortable dealing customersdont enjoy solving customer problem helpfulplan pursue pure programming career internship allowancenew intern softinn rm per monthalumni intern softinn rm rm per month intern benefitsmonthly outingsfree flow snack additional perk rolepluralsight subscriptionhubspot crm license marketing hub prohubspot crm certification certificate name pas testsummary role requirementslooking candidate available workmonday morning afternoontuesday morning afternoonwednesday morning afternoonthursday morning afternoonfriday morning afternoonno experience required roleworking right required role,https://www.jobstreet.com.my/companies/softinn-168552588133058/reviews?jobId=76089003,4.7,25.0
Internship - Website Developer & Product Marketing,Softinn Solutions Sdn. Bhd.,ayer keroh,undisclosed,5d ago,29/5/2024,https://www.jobstreet.com.my/job/76088803?type=standard&ref=search-standalone&origin=cardTitle#sol=d985c9e8af50a717fba016b0b1a8428474c4571c,softinn hotel technology company mission make hotelier work easier intend achieve nextgeneration hotel management software digital solution hotel kiosk here oneminute video productswere selling forwardlooking hotelier south east asia customer malaysia philippine indonesia thailandsoftinn build business software kiosk ecommerce solution hotel hotelier use product run business operation average user interact product per minuteour internship website developer product marketing meant basic html programming skill want pursue career web design digital marketingthis position suitable student studying computer science job responsibilitycreate maintain softinns official websitedesign implement iterate webpage homepage landing page etc seo friendlycollaborate marketing design teambrainstorm implement technical digital marketing strategiesimplement digital marketing campaign eg landing page seo ad tracking etcjob requirementscurrently pursuing diploma bachelor information technology related technical fieldgood understanding html javascript cssreasonable foundation algorithm analytical skillsproficient english written spokenability communicate clearly team membersthe minimum internship duration month preferably month mandatory bonus iffamiliar figma google analytics canvayou experience creating beautiful websitesunderstand digital marketing report work optionsmelakawork remotely join youenjoy building website sellsa strong believer better product help improve efficiency bring smile hoteliersnot afraid ask questionsnot afraid find solution seek help otherslooking casual working culture join youplan learn google analytics seoplan pursue pure programming career another internship prefer pure programming without need learn digital marketing design internship allowancenew intern softinn rm per monthalumni intern softinn rm rm per month intern benefitsmonthly outingsfree flow snack additional perk rolepluralsight subscriptionhubspot crm license marketing hub prohubspot crm hubl programming certification certificate name pas test notesany contribution opensource initiative one best way get attentionsummary role requirementslooking candidate available workmonday morning afternoontuesday morning afternoonwednesday morning afternoonthursday morning afternoonfriday morning afternoonno experience required roleworking right required role,https://www.jobstreet.com.my/companies/softinn-168552588133058/reviews?jobId=76088803,4.7,25.0
Internship - Backend Programming,Softinn Solutions Sdn. Bhd.,ayer keroh,undisclosed,5d ago,29/5/2024,https://www.jobstreet.com.my/job/76088767?type=standard&ref=search-standalone&origin=cardTitle#sol=f84638c355d651d2636f99f49d7e933989df2082,softinn hotel technology companyour mission make hotelier work easier intend achieve nextgeneration hotel management software digital solution hotel kiosk here oneminute video productswere selling forwardlooking hotelier south east asia customer malaysia philippine indonesia thailandsoftinn build ecommerce solution business productivity tool hotel develop net technology stack opensource frontend library information found builtwithour internship programmer program meant passion programming want pursue programming careerthe coding world divided two understand enjoy binary dont former join u make differencejob responsibilitieswork product team develop website web applicationsbe involved feature development maintenance productscreate featuresmodules support core systemslearn modern web technologiesunderstand concept cloud solutionsjob requirementscurrently pursuing diploma degree information technology equivalentreasonable programming skill understanding algorithmsability code ccjavaknowledge object oriented programmingability communicate clearly effectively team membersability work team environmentthe minimum internship duration month preferably month accept application internship period le monthsin general skill set typically tell people want arecodingplanningplaying mandatory bonus havestrong programming skill c javascriptexperience web development work locationsmelakawork remotelysummary role requirementslooking candidate available workmonday morning afternoontuesday morning afternoonwednesday morning afternoonthursday morning afternoonfriday morning afternoonno experience required roleworking right required role,https://www.jobstreet.com.my/companies/softinn-168552588133058/reviews?jobId=76088767,4.7,25.0
Internship - Frontend Programming,Softinn Solutions Sdn. Bhd.,ayer keroh,undisclosed,5d ago,29/5/2024,https://www.jobstreet.com.my/job/76088754?type=standard&ref=search-standalone&origin=cardTitle#sol=bc58bb625d90876ecf64d615b886e1b868a62465,softinn hotel technology companyour mission make hotelier work easier intend achieve nextgeneration hotel management software digital solution hotel kiosk here oneminute video productswere selling forwardlooking hotelier south east asia customer malaysia philippine indonesia thailandsoftinn build ecommerce solution business productivity tool hotel develop net technology stack opensource frontend library information found builtwithour internship programmer program meant passion programming want pursue programming careerthe coding world divided two understand enjoy binary dont former join u make differencejob responsibilitieswork product team develop website web applicationsbe involved frontend feature development improvement user experiencelearn concept uiux developmentunderstand concept cloud solutionsjob requirementscurrently pursuing diploma degree information technology equivalentbasic programming skillsability code java equivalentability communicate clearly effectively team membersability work team environmentthe minimum internship duration month preferably month accept application internship period le monthsin general skill set typically tell people want arecodingplanningplaying mandatory bonus haveexperience htmlcssknowledge frontend framework angular reactjsexperience web development work locationsmelakawork remotelysummary role requirementslooking candidate available workmonday morning afternoontuesday morning afternoonwednesday morning afternoonthursday morning afternoonfriday morning afternoonno experience required roleworking right required role,https://www.jobstreet.com.my/companies/softinn-168552588133058/reviews?jobId=76088754,4.7,25.0
Intern - Data Science,Sunway Property,bandar sunway,undisclosed,5d ago,29/5/2024,https://www.jobstreet.com.my/job/76080706?type=standout&ref=search-standalone&origin=cardTitle#sol=2b4e01568bcce113b5a2682faa52093161a9f3f6,role briefjoin u data science intern youll merge data science quality environmental safety health initiative property development construction dive datasets create impactful visualization using autodesk tool collaborate across team document insight lasting impact youre passionate shaping sustainable future datadriven solution internship gateway making meaningful difference whats job scope likework property development constructionrelated datasets regard quality environmental safety healthdigitalize existing process regard quality environmental safety health standard companyconduct exploratory data analysis uncover insight pattern data visualisationcreate compiling informative data visualization using powerbi communicate finding effectivelycreate dashboard able effectively monitor project datawork closely crossfunctional team build communicate usage dashboardsdocument code methodology result allow continuity work looking forcandidates data science backgroundability process analyse large volume data information posse excellent command english language written oral strong communication negotiation analytical skillscritical thinking able use logic reasoning identify strength weakness alternative solution conclusion approach problemsfamiliarisation microsoft power bi microsoft excel added advantage note job scope provided general guideline specific task responsibility may vary based need sunway property ongoing project internship period,https://www.jobstreet.com.my/companies/sunway-berhad-168552171280747/reviews?jobId=76080706,4.0,81.0
Graphic Design Internship (IT),ASUSTek Computer Malaysia Sdn Bhd,kuala lumpur,undisclosed,5d ago,29/5/2024,https://www.jobstreet.com.my/job/76079605?type=standout&ref=search-standalone&origin=cardTitle#sol=929f065b8adf8aced5c07c0b10b44740d21e93de,responsibilitieshandle aspect website design development management maintenance troubleshootingto assist design marketing material ie website ebrochure banner posm dealer shop wallpaper event launching designsupport marketing team special project duty requiredrequirementsfulltime student attending ndrdfinal year undergraduatepostgraduate creative multimedia multimedia design advertising information technology equivalent accredited universitycollegeinternship must part universitycolleges academic requirementrequired language bahasa malaysia english mandarin,https://www.jobstreet.com.my/companies/asus-168557460638291/reviews?jobId=76079605,3.8,17.0
Internship for Computer / IT,OTC TRAINING CENTRE SDN. BHD.,gelugor,undisclosed,6d ago,29/5/2024,https://www.jobstreet.com.my/job/76070822?type=standard&ref=search-standalone&origin=cardTitle#sol=2f6c85943a7885872be5152d93510a59ef4ced12,requirementswilling learn take challenge hardworking flexible task given required language bahasa malaysia english required computing knowledge m excel m power point m wordresponsibilityto monitor maintain regular record office administrative operation reportto manage administrative function participant registration coordination administration related mattersconduct market research get feedback participant programsprovide support administration function data analysis submission report timebenefitsfully training providedsummary role requirementsflexible hour availableno experience required roleworking right required role,,,
IT INTERNSHIP,Ajiya Berhad,puchong,undisclosed,7d ago,29/5/2024,https://www.jobstreet.com.my/job/76041129?type=standout&ref=search-standalone&origin=cardTitle#sol=0b9edfd3a2ae67220e3db72195292f18d1b73d1f,usajiya berhad ajiya group company group started metal roll forming company using brand name ajiya group ventured production high valueadded safety glass product ajiya product cater wide variety user industrial commercial building common residential house qualification experiencedegree information technologycomputer sciencetasks responsibilitiesunderstand ajiya network framework eg domain tcpip proxy mail service voip service smi link vpn service antivirus protection understand importance data backup restorationlearn install configure troubleshoot software program well hardwareunderstand ajiya ict infrastructureunderstand importance managing ict asset eg software hardware inventory fixed asset pc cleanliness erp support documentation assistance sap business one support documentation assistance benefitslunch subsidyfriendly working environment,https://www.jobstreet.com.my/companies/ajiya-berhad-168551871187223/reviews?jobId=76041129,2.3,3.0
Summer Internship - Planner,MICRON MEMORY MALAYSIA SDN. BHD.,batu kawan,undisclosed,7d ago,29/5/2024,https://www.jobstreet.com.my/job/76045900?type=standard&ref=search-standalone&origin=cardTitle#sol=f910f7de5f3da3c163d041d8584439d482288c6a,vision transform world us information enrich life micron technology world leader innovating memory storage solution accelerate transformation information intelligence inspiring world learn communicate advance faster ever jr summer internship planner project title inventory management po closure description work manufacturing team control monitor inventory reduce aging open po scope assist production monitor control inventory work engineering qa team release hold move inventory consolidate product qual data monitor po teco kpi inventory kpi measure otd time delivery shipment per target delivery date deliverable kpi need meet target tableau data integrity report readiness stretched goal recommend handle hvm product inventory management po closure kpi micron technology inc industry leader innovative memory storage solution transforming world us information enrich life relentless focus customer technology leadership manufacturing operational excellence micron delivers rich portfolio highperformance dram nand memory storage product micron crucial brand every day innovation people create fuel data economy enabling advance artificial intelligence g application unleash opportunity data center intelligent edge across client mobile user experience learn please visit microncomcareers qualified applicant receive consideration employment without regard race color religion sex sexual orientation gender identity national origin veteran disability status request assistance application process andor reasonable accommodation please contact hrsupportmymicroncom micron prohibits use child labor complies applicable law rule regulation international industry labor standard micron charge candidate recruitment fee unlawfully collect payment candidate consideration employment micron,https://www.jobstreet.com.my/companies/micron-semiconductors-168551078128068/reviews?jobId=76045900,3.8,33.0
Sustainability Intern,Averis Sdn Bhd,bangsar south,undisclosed,8d ago,29/5/2024,https://www.jobstreet.com.my/job/76009880?type=standout&ref=search-standalone&origin=cardTitle#sol=07c7806b226fa8a6be52e2c447cfefe646fe1e3a,job highlight bangsar south near lrt kerinchi station job responsibility support development implementation monitoring sustainability action plan program deliver company identified sustainability commitmentscollate analyse data support delivery stakeholder engagement strategy relevant project activitiescollate assist preparation sustainability report project report presentation document assigned superiorassist collation preparation quarterly traceability dataassist drafting response stakeholder query based guidance superiorassist obtain relevant sustainabilityrelated information including documentation refinery internal department based customer queriesprepare update internal tracker project stakeholder engagement section progress ensure stakeholder query replied timely manner remind superior dateline based tracker developedwork relevant department manage update sustainability information company websiteundertake related appropriate task assigned superior job qualification skill bachelor degree agriculture forestry environmental science sustainability related fieldsbasic knowledge sustainabilitygood written verbal communication skill englishability work independently part teamproficiency microsoft officepreferably augsept intake least month internship,https://www.jobstreet.com.my/companies/averis-168553249170002/reviews?jobId=76009880,3.1,90.0
Internship for Programmer,Biz Process Solutions Sdn Bhd,butterworth,undisclosed,8d ago,29/5/2024,https://www.jobstreet.com.my/job/76004468?type=standard&ref=search-standalone&origin=cardTitle#sol=a54dbcea8b572d46c1f21e652b91e748fb58df9a,u since company providing customized solution business operation logistics warehousing automation integration middleware einvoicing clientele span across south east asia usjob scopeassist fulltime developer software developmentrelated taskscandidates required posse minimum understanding phpmysqlfamiliarity mvc framework laravelzend added advantageopportunity gain handson experience supporting developing various application including saas iot mobile apps android iosproficient english communication skill plusseveral fulltime position software implementor development available kindly contact u detail great opportunity awaits important notesplease specify internship period durationapplicants must eligible work penang,,,
IT Service Desk Intern (6 Months),Roche Services & Solutions Operations APAC,bandar sunway,undisclosed,8d ago,29/5/2024,https://www.jobstreet.com.my/job/76003433?type=standard&ref=search-standalone&origin=cardTitle#sol=63d97f47b306361bc33f0232d58d062f5cc838a3,roche foster diversity equity inclusion representing community serve dealing healthcare global scale diversity essential ingredient success believe inclusion key understanding people varied healthcare need together embrace individuality share passion exceptional care join roche every voice matter positionoverviewa healthier future drive u innovate continuously advance science ensure everyone access healthcare need today generation come creating world time people love thats make u roche service desk intern play pivotal role providing firstlevel support incident request end user across window google apple environment responsibility encompass troubleshooting software hardware issue facilitating software package installation configuration offering assistance various type hardware device role operates within highly innovative technologically advanced environment sharing knowledge actively contributing enhancement service encouraged key responsibilitiesas primary point contact responsible providing firstlevel support software hardware incident service request across apple window google environment via multiple communication channel including telephone email chat selfservice portal ticketing applicationsyou contribute knowledgesharing initiative providing insight contributing article knowledge database delivering training session facilitating forumsyou act liaison end user team ensuring prompt resolution issue escalating complex situation necessaryyou keep endusers informed status request guiding optimal solution enhance productivityyou adhere rotational shift schedule working least morning afternoon shift support followthesun model requirementsenrolled undergraduate student reputable university relevant field studydemonstrated track record consistently strong academic performancethe internship duration six month areat roche people across country pushing back frontier healthcare working together weve become one world leading researchfocused healthcare group success built innovation curiosity diversity roche service solution well people support solution organisation located kuala lumpur provide endtoend business solution finance procurement communication people culture human resource beyond roche colleague across apac region today roche employ altogether around employee malaysia roche equal opportunity employer,https://www.jobstreet.com.my/companies/roche-168553946317737/reviews?jobId=76003433,4.1,50.0
Internship,MATHEVON MALAYSIA SDN. BHD.,gelang patah,undisclosed,8d ago,29/5/2024,https://www.jobstreet.com.my/job/75993790?type=standard&ref=search-standalone&origin=cardTitle#sol=8b3c175a0c2625dd275cd56632b05ccc11a7a42a,looking proactive detailoriented health safety intern support health safety department successful candidate work closely experienced health safety professional gain handson experience various aspect occupational health safety management internship offer excellent opportunity individual pursuing career health safety apply knowledge realworld setting contribute meaningful project within organizationkey responsibilitiesassist conducting regular safety inspection audit identify hazard ensure compliance regulatory requirement company policiescollaborate health safety team develop implement safety training program employee including topic hazard communication emergency response personal protective equipment ppe usageparticipate incident investigation analyze root cause recommend corrective action prevent recurrencesupport maintenance health safety record documentation including incident report training record safety data sheet sdsassist development review safety policy procedure guideline promote culture safety within organizationstay updated relevant health safety regulation industry best practice ensure compliance continuous improvementprovide general administrative support health safety department including data entry file organization report preparationqualificationscurrently enrolled program occupational health safety environmental health industrial hygiene related fieldstrong interest pursuing career health safetybasic knowledge occupational health safety principle regulationsexcellent communication interpersonal skillsability work independently part teamproficiency microsoft office suite word excel powerpointattention detail strong organizational skill,,,
